1;Muito ruim; Não gostei, usei o celular nem um mês já deu problema. 
1;Nao recomendo; Nao recomendo tive alguns problemas que travam demais o whats chega sms fica preta a tela e é muito lento em comparaçao a outros aparelhos do mesmo valor mais inferiores. 
5;Excelente; Produto bom que atende as necessidades do cliente que procura um aparelho simples pro dia a dia no trabalho. 
2;Ruim; Muito bom só a camera que não gostei,. 
4;show; Otimo produto, muito bom, excelente tem muitas utilidades. 
5;Perfeito ; Superou minhas expectativas , produto excelente super rápido, impecável sem contar com os brindes que vem com ele, super recomendo para todos comprar!. 
5;Excelente; O produto eh excelente eu recomendo, é leve pratico di usar a motorola ta di parabéns. 
4;Ótimo produto, compraria novamente sem medo ; Excelente qualidade porém esquenta muito. Um dos melhores custo x beneficio. 
4;Muito bom; Muito bom produto , satisfeito com a compra. 
5;Ótimo ; Pelo preço ele é o melhor do mercado sem dúvidas!. 
1;PRODUTO SEM NOTA FISCAL; Produto sem nota fiscal, não recomendo. 
1;porcaria ; Uma porcaria parou com uma semana. 
2;Mão tem TV ; Mão velho a nota fiscal né o manual. 
1;comprei por ser original e não é original e nem br; Comprei pra ser brasileiro mas não é. 
1;Não gostei; Vendo uns pontos, parece réplica. Não gostei. 
1;BATERIA DESCARREGA RÁPIDO DEMAIS; Bom. 
2;Sem comentários; Poderia especificar melhor que ele só pegar chip da vivo, porque entendi que ele vinha com um chip da vivo. 
4;Bom; Funcionou certo, fácil de usar. 
5;Excelente; Muito bom. 
2;Para resumir não compre propaganda enganosa; Péssimo o produto não é original na claridade fica esbranquiçado a tela sem falar que a bateria e péssima. 
4;Muito bom; So não foi 5 estrelas, pois as fotos não consigo visualizar, mas o resto funciona perfeitamente,câmera mto boa, design moderno. 
5;Gostei muito; Eu gostei veio lacrado com todos os cabos fones. 
4;Ótimo ; Um bom produto, com um preço ótimo. Uma boa compra. 
4;Muito bom eu recomendo ; Muito bom eu recomendo a todos. 
5;Excelente; Ótimo celular recomendo está de parabéns. 
5;super top; Muito bom produto bom, top rápido, não trava, recomendo muito. 
1;Muito ruim; Trava toda hora e muito ruim sua memoria e ftaca de mais so serve pa atender as chamafas mesmo. 
5;Show; Muito bom, custo benefício excelente. 
5;Excelente; Gostei recomendo muito, bom de sinal ,bateria também e muito boa. 
1;Não gostei.; Esse celular não corresponde às espectativas , bateria ruim , e não tem uma câmera boa , nem parece ser original , muito ruim. 
1;Ruim; Não gostei, som baixo, não consigo acertar relógio e calendário para atualidade. 
1;Muito ruim; Celular veio com defeito!!. 
5;Excelente; Muito bom superou minhas expectativas. 
5;Excelente; Mto bom. 
1;Nao muitobom pq da bateria; So a bateria nao muito boa de resto tudo funciona. 
1;uma porcaria ; Uma porcaria usei o celular 2 dias queimou. Lamentável dinheiro perdido. 
1;EXTREMAMENTE ARREPENDIDO.; O produto em termos de configuração é bom. Porem é péssimo de bateria e esquenta demais, liguei no sac da lg e me informaram que é assim mesmo. Fiz um péssimo negócio. Arrependido. 
5;Bom demais, ótimo!; Produto muito bom, satisfeito demais. 
5;Ai que tuuuuuudooooooo!!!; O aparelho é muito bom, eu ja conhecia ele, relação custo beneficio pro meu gosto e uso está excelente, se perder ou quebrar eu compro outro do mesmo. 
1;não posso opinar, não funcionou.; Infelizmente, não funcionou, não liga nada, e nem sei o que fazer, não sei se tem garantia, se puderem me ajudar ficarei grato. 
5;Muito bom; Um produto muito bom recomendo. 
4;Muito bom; Muito bom. Para o trabalho que executo. Leve pratico tamanho pefeito nao trava. 
2;Ruim; Eu nao gostei desteproduto e nao recomendo a ninguem. Marca não recomndendada. Ja tive problemas logo no começo não pegava o wifi. A tela do telefone não responde aos comandos. Demora muito entrar um aplicativo. 
5;Bom aparelho no que se propõe; Bom celular, ótima duração de bateria e configurações justas pelo preço!. 
1;Muito ruim; Quero relatar que comprei o celular de dois chips veio de quatro chips erado e péssimo obrigada. 
2;Muito bom.; Um produto muito bom, quero comprar outro. 
5;OTIMO; Com um design bem bonito , pequeno e pratico me agradou bastante esse celular. 
5;Bom produto; Otimo produto. 
1;tudo que não presta não deveria ser divulgado.; Vou deixa vocês mesmo ter suas próprias conclusão de como é fácil fazer uma imagem de um aparelho como este e enganar as pessoas. 
1;Muito ruim; O aparelho aparenta ser maior é muito pequeno. 
1;Reclamação; O produto não veio com o selo da anatel, e agora? será bloqueado??? quero meu dinheiro de volta. 
5;Excelente; Aparelho de ótima qualidade. Recomendo. Atendeu minhas expectativas. 
1;produto com defeito ; A pulseira arrebentou na primeira vez que coloquei. 
5;Bom; Bom, simples e objetivo pratico. 
1;Um aparelho com defeito , uma porcaria ; Veio com defeito no toushi, os correios estavam em greve acabei ficando. Mais tive que pagar pra concerta. Única decepção de compra até hoje. 
1;Produto de péssima qualidade, falsificado; Péssimo produto, falsificado, não recomendo. 
1;Muito ruim; Não foi oque eu esperava o telefone é da china é muito ruim não tem nada de memória. 
1;Satisfatório; Produto muito bom, mais quando baixados jogos populares que são costumados baixar aparece sempre uma mensagem dizendo que não está funcionando direito se eu desejo informar o problema, no meu outro aparelho não acontece isso so nele. 
1;Triste; Decepcionante. Gato pôr lembre. 
5;para bens; Muito bom. 
5;otimo; Ótimo produto excelente celular atendeu minha expectativa. 
5;Excelente; Muito bom. 
1;Fraude!; Falsificado de péssima qualidade !. 
5;Bom custo-benefício; Estou usando há pouco mais de duas semanas e sem problemas. Bom custo benefício. Rápido. Bom som. Enfim, ótimo custo benefício. 
1;nao coprem nessa loja nao entregaram minha compra; Nao emtregaram minha compra nao coprem nessa loja. 
5;BOM; Mt bom gostei de mais do celular. 
2;insatisfeita ; Comprei dois aparelhos desse no mesmo dia. Os dois estufaram a bateria com 4 e 5 meses de uso. E nao encontra se facil a reposiçao da bateria. Pelo menos aqui em joao monlevade procurei em todas as lojas. Afff. 
2;Ruim; Ele está dando problema. Desliga e trava tbm. 
1;Produto Falso ; Produto falso, caixa veio com o aparelho que dizem que é original "importado" e a bateria não tem a marca nela. O carregador é de feira de produtos do paraguai que vem com um cabo adaptador qualquer. Veio sem manual de instruções e nenhuma garantia. Muito decepcionada, ainda mais que era presente. Irei devolver! quero reembolso !. 
5;100% aprovado; Otimo produto de confiança podem compra. 
4;Muito bom; Muito bom, recomendo ótimo aparelho. 
5;Excelente; Excelente! muito bom o celular. Melhor em relação a custo-benefício. 
4;Muito bom; Gostei muito do celular , fácil de usar , ótimas fotos. 
5;Excelente; Ótimo muito bom. 
2;decepçao.; O celular é otimo, mais o carregador dele é horrivel, nao da nas tomada de minha casa. 
1;não recomendo.; Estragou com 5 meses de uso. Deu pani no sistema. 
5;bnos negócios ; Ótimo muito bom produto qualidade. 
4;Muito bom; Ótimo aparelho, pequeno mais bem eficaz. Eu queria ele mais para antena rural mais não serviu na antena. 
2;Não vale a pena!!!; O aparelho tem um ótimo custo benefício, porém apresenta falhas na plataforma android (trava muito) o que torna a experiência do usuário desagradável. Câmera (traseira) grava vídeos como muitos granulados na imagem, hardware de péssima qualidade!. 
1;Muito ruim; Péssimo produto, alto-falante ruim,som da campainha muito baixo com poucas opções para trocar por um som mais alto, não é original resumindo não recomendo a ninguém comprar o produto! vou jogar fora o produto!. 
4;muito bom o produto.; Produto bom custo benefício superou as expectativas, gostei muito. 
1;R...; Olá preciso de um número de telefone seu para q eu possa te passar o poblema q estou tendo com a compra q fiz com vcs. 
5;Excelente; Celular com. Leve. Nao trava. Camera excelente. Recomendo. Ate agora tudo ok. 
1;Muito ruim; Muito ruim não funcionou nem um dia ficou maluco. Ligando só dinheiro jogado fora uma porcaria fui. 
5;Excelente; O telefone está funcionando bem, acoplado a uma antena externa. 
5;Muito bom; Muito bom o produto superou minhas expectativas pega o sinal muito bem!!!!. 
2;Estou esperando vendendo entrar em contato comigo ; Um lixo porque veio com defeito e até agora estou esperando vendendo para falar comigo vou entrar com um processo vou chamar reportagem para voces já que voces não revólver. 
5;Excelente; Ótimo produto. 
2;Excepcional; Super recomendo o produto so atrasou um pouco mais é otimo. 
4;CELULAR DE 1A LINHA, SATISFEZ MINHA VONTADE, AMEI!; Produto de 1a linha muito bom, bateria dura muito, enfim amei, recomento para qualquer pessoa comprar, show de bola , nota dez. 
5;Produto de excelente qualidade; Muito bom,um dos melhores q já usei aconselho a todos q quiserem fazer aquisição. 
5;é otimo amei!!!!!; Ele me atendeu e otimo ameiiiii. 
1;Gostei ; Bom gostei. 
2;Ruim; Nao gostei muito rigida ja quebbrou botao de ligar. 
5;Recomendo; Produto bom. 
5;Goste muito o celular ele bom de mais; Eu goste muito o celular ele e bom de mais. 
5;Excelente; Ótimo produto! superou minhas expectativas pois foi um presente dado ao meu sogro e ele soube manusear direito e sem complicações!!!. 
1;Muito bom; Muito bom pode compra vc não vai se arrepender. 
1;ruim; Muito fraquinho mas tenho que usa-lo. 
1;Pessimo; Na minha opinião, ele é bacana porem, eu ñ gostei, primeiro eu queria uma cor preta e veio outra cor, segundo a entrada para o cartão sim 1 ñ funciona e para piorar queimou o meu chip, mas fora tudo isso ele tem um belo designer e finalizo dizendo que ñ me arriscaria em comprar novamente. 
1;Ameiiiiii ; Bom é ótimo. Vou comprar sempre agora. 
5;Produto superou minha expectativa.; Excelente produto. Realmente muito bom. 
5;Excelente; Ótimo muito bom. 
1;Queimou a tela; Efetuei a compra do galaxy j5 pro na black friday e menos de 1 mês depois o telefone queimou a tela sem mais nem menos. Produto de péssima qualidade e estou enviando para troca do aparelho. 
2;Fraco. 9; Não gostei pois o som dele é muito baixo. 
1;Muito bom recomendo; Otimo perfeito estado adorei. 
4;Muito bom tem todas as funções que precisava ; Muito bom, tem todas as funções que precisava. Além do preço ascensível a todos. 
2;Bom; Gostei do produto muito bom de mais. 
2;Para quem não quer gastar muito; O celular não é o divulgado, é na verdade um ching ling chinês de tudo !. 
4;Otimo produto??????; Gostei comprei para minha mae. 
5;Opção para quem quer qualidade com preço baixo.; Produto na medida para quem deseja qualidade com preço baixo. Vantagem para nós, consumidores brasileiros ,acostumados a pagar caro por péssimos produtos e serviços. Difícil mesmo é encontrar alguém arrependido de comprar celulares da xiaomi. 
1;Muito ruim; Produto veio com defeito e sem nota fiscal, fui tratado com ironia qdo me queixei. 
2;Não compensa melhor comprar k6 ; Não compensa , melhor compra o k6 , stela é apenas hd , e não tem como atualizar para versão 6. 0 , obs vem com android defasado. Trava muito em jogos , até mesmo em jogos leves como lara croft relic run. 
5;Rápido entrega ; Otimo. 
2;Não tem uma utilização fácil; As configurações não são nada acessíveis. Não consigo alterar o número do botão de emergência, modificar o volume do toque e usar os dois slots de chip. 
4;Produto muito bom; Produto muito bom, fino, funciona direitinho. Recomendo. 
5;otimo; Muito bom saio tudo nos canformes. 
5;Show de bola; Excelente aparelho. Minha esposa está usando e eu o manuseio as vezes. Ele é tão rápido quanto meu moto g 3ª geração. Excelente custo benefício. Bateria tem boa duração. Valeu muito essa compra. Blu é desconhecido mas tem muita qualidade. 
1;PRODUTO RUIM ; Produto nao aguentou 4meses ja descolou a tela e foi utilizado com muito cuidado. 
1;Péssimo; Não fiquei satisfeita,o aparelho trava muito. Só instalei 3app do playstore. Não gostei. 
5;Ótimo para realidade virtual; Excelente custo benefício. Features avançados e ótimo para visualizar conteúdos em realidade virtual usando o óculos google cardboard. 
5;Excelente; Excelente desempenho atendeu minhas expectativas, indico para todos. 
2;ruim; Muito ruim. 
1;Atendimento péssimo... ; Só vou opinar sobre o produto quando eu receber tudo o que eu comprei. Isso é um absurdo. Quero meu produto. 
1;Exelente; Ótimo produto,superou minhas expectativas. 
4;boa compra; Rapido , bonito so nao vem com antena. 
4;Otimo; Produto muito bom ! valeu o custo benefício!. 
5;Excelente; O celular é muito bom e vem desbloqueado vale a pena compra. 
2;regular; Apesar dos numeros grandes ajudar bastante , a pessoa que ta usando teve dificuldades no uso das teclas de acesso. 
1;Ruim; Desculpa ruim não consigo baixar nada e não da nem pra ver vídeo. Queria saber como faço. 
1;Muito ruim; Fiz essa encomenda e não fiquei satisfeita. Demorou muito!!!! e o produto veio arraanhado "muita coisa"os itens como tomada eram diferentes do fio. Produto de segunda. 
2;Ruim; Produto já foi aberto, está com pintas na tela, não é um produto novo. 
5;Atende bem; Bom. 
2;Esquenta muito a dá problema no display; O produto é muito bonito. O custo benefício é ótimo, a câmera é boa, a bateria tem boa duração, mas ele tem um defeito grave: se for utilizado por tempo prolongado ele esquenta demais. Dependendo de quanto tempo ele fica "quente", passa a dar problema no display, que "apaga". E depois que isso acontece, o apagão é intermitente. Hora a tela funciona, hora apaga. Ainda que esteja com a tela preta o celular se mantém funcionando, porém se você receber uma ligação ficará impossibilitado de atender, porque não tem como "tocar" no ícone da tela. Estou com um aparelho desses parado em casa por conta desse problema. Não recomendo a compra deste modelo (tenho também um blu 5. 5 grand hd. Esse sim é pau pra toda obra. Apesar do uso prolongado, nunca esquentou além do aceitável e jamais deu problema, mesmo com quase 1 ano em uso). 
1;totalmente insatisfeito produto não era original; Não gostei. 
1;produto defeituoso; Produto com defeito. Não toca. Não enviou nota fiscal. 
1;Inferior e não original; Produto inferior e sem nota fiscal. Não gostei. 
1;REVOLTANTE, DEMOROU MES DE UM MÊS PARA RECEBER; 
5;Excelente; Gostei muito do celular recomendo! até agora muito satisfeito,o carregador veio sem funcionar! mesmo assim fique feliz com a aquisição. 
1;Muito ruim; Não gostei de nd ,pq o celular não funcionava quase nd e pegava redes sociais horrível , e veio um carregador de duas cores ,não veio notas fiscal e tem mas eu já tinha comprado coisas pela internet e nunca me aconteceu isso de comprar e não receber agora vou pensar se um dia vou voltar a comprar no mercado livre. 
1;usei a penas 16 dias; Apenas 16 dias de uso parou de funcionar. Não levou queda nem agua. E parou total. No inicio achei um bom aparelho mas dai mim decepcionou. Espero que resolva minha situação. 
2;Ruim; Aparelho fraco e as cameras muito ruim a noite. 
1;Otimo; Ótimo. Sem dúvida o melhor. 
2;Muito lento; Produto bom porém lente não recomendado. 
1;Não é celular para idoso. Tire do catálogo!; Equipamento terrível. Não possui volume para campanhia, e é muito baixo o toque de fábrica. Não tem opção de troca de toque. Um idoso não consegue ouvir. Quando a bateria acabou, desconfigurou o relógio. Não compre este aparelho para uso de idosos. Tela muito pequena. 
1;Bom e prático; Bom prático e fácil de usar. Mas acho um pouco dificil pra abrir poderia ser mais prático. 
1;Bateria fraca; A bateria dura pouquissimo. Totalmente insatisfeito. 
4;Muito bom; Produto otimo recomendo. 
1;Vendedor ótimo produto defeituoso.; Produto sobre aquece e trava aquece tanto que rachou minha carcaça, não funciona o áudio, não tem código de imei e não está havendo sinal da operadora. Primeiramente recomendei o produto porque comprei um e funcionou perfeitamente, mas este está péssimo. 
5;MUITO BOM; Muito bom, superou minhas expectativas. 
2;Aparelho com qualidade duvidosa; Com 1 mes de uso não funciona mais a parte de audição, não ouço quem me liga. Enviei para assistência, aguardo resposta. Deixou muito a desejar. Aparelho novo já apresentando problema, estou totalmente insatisfeito!!! espero que resolvam o problema. 
4;otimo produto; Muito bom! produto aprovado p quem gosta de uma tecnologia simples. 
1;começou dar defeitos ; Não gostei pq já apresenta defeitos. Não quer fazer ligação e desliga a luz sozinho. 
5;Excelente; Ótimo !,,,,!,,,,,,,,,,,,,,,,,mmmmmm mmmmm m. 
1;VENDEDOR NÃO CONFIÁVEL; O carregador que veio na caixa e falso e o modelo também e diferente de um original. Comprei um carregador original que deveria vir na caixa. O fone que veio e da china tenho foto do lado de um original. Segue as printis. Caso quiserem ver as fotos copiem os links e abrem no navegador. Carregador. Http://prntscr. Com/hzzfnc (original). Http://prntscr. Com/hzzg0d (falso que vem na caixa). Fone. Http://prntscr. Com/hzzghq. (ao lado o original e o da china que eles mandam ). 
5;celular; Muito bom o produto gostei. 
1;Ruim; A rede que eu queria que pegase nao pega de geito nenhum fui na assistencia e em diseram que o problema é no celular. 
2;Gostei; Gostei. 
2;Não possui 16Gb de memória!; Produto é bom, rápido, responde bem, ótimo desempenho. Mas a câmera é péssima e a memória interna passa longe dos 16gb. Memória real é de 10. 13gb, sendo apenas 7gb disponíveis para o usuário. 
1;Não é resistente a água ; Ruim, vi vídeos no youtube sobre ele, q podia molhar, coloquei o meu embaixo da torneira, ele desligou, só voltou a funcionar depois de 2 dias. 
1;A marca é boa,mas este não vale apena; Bonito,mas muito ruim,trava muito,nao abre certos vídeos ou arquivos. 
1;FALTOU A NOTA FISCAL; Faltou a nota fiscal. 
1;Celular; O produto tem um padrão diferente de todos motorola que já tive. 
1;Muito ruim; Nao è muito bom nao. Tem hora que ele trava. Nao roda os videos do youtube, grato!. 
4;bom; Bom. 
4;muito bom; E um bom aparelho de entrada para idosos , crianças recomendo a todos. 
5;Excelente; Show, muito bom eu recomendo. 
1;Perfeito amei. ; Muito bom o produto gostei recomendo para todos que comprem. 
5;Excelente; Show. 
1;Atrasado; Produto bom porem atrasou muito!!. 
5;Ótimo produto; Ótimo produto, atendeu as expectativas!!. 
4;travando !!; As vezes o celular trava ele é muinto bom otimo o ruim é que trava umj pouco posia der melhor eu acho. 
2;Ruim; Fiz esta compra mas nao gostei o telefone muito pequeno mas eu que fui culpada so eu obrigada marcia. 
1;nao compre nada (fui enganado pelo vendedor); Nao recomendo pra ninguem produto que ja tinha dado defeito ,recuperou com algumas pecas e e vendido como celular de vitrine deu defeito em 20 dias e nao cumpriu com a garantia. 
1;Ruim; Estragou dentro de 1 mês , e agora neim sei se tem garantia. 
1;Produto péssimo! ; Veio com muito defeito!. Devolvi está a caminho para a loja analisar e me devolver o dinheiro!. 
1;Aparelho muito fraco!; Aparelho muito fraquinho, mas quebra o galho!!!!. 
5;Excelente; Perfeito. 
2;Tem suas qualidades; Razoavel so acho quê esquenta muito as vezes penso que vai explodir nao sei se é normal ou e defeito meso gostaria ate de saber ok mais e um bom aparelho. 
5;MUITO bom mesmo; Excelente muito bom recomendo a todos. 
5;Excelente; Muito bom. 
1;Uma merda; Vcs disserão que o celular era original e claro que não é. Se colocar na justiça quero ver vcs venderem essas porcarias. E aí vão mandar um celular original?ou não. 
2; Sistema de configurações complicado; O sistema de configurações é um tanto complicado para idosos. Podia ser mais simples e objetivo tipo os "nokias". 
1;Muito ruim; Não gostei , ta sempre com a operadora em ligação somente emergencia , isso não é normal. 
1;Muito ruim; O produto não superou as minha espequitativa. 
5;Excelente; Muito bom. 
5;Sensacional ; Ótimo produto, do jeito q esperava. Resistente e a carga da bateria e de longa duração. Para quem quer um celular simples pata trabalhar ele é ideal. 
4;Muito bom; Muito bom vale a pena recomendo. 
1;Muito ruim; Não gostei do produto, inclusive não estou usando, muito ruim! falaram que era original e não é. 
5;Excelente; Ótimo produto, simples porém muito eficiente, estou satisfeita. 
2;NÃO COMPRARIA NOVAMENTE SISTEMA OPERACIONAL FRACO ; Adrenalina o: o preço até que esta bom, mas o celular não é bom!. Arrependi de ter comprado. 
5;Ótimo; Produto de boa qualidade, amei !. 
5;Excelente; Gostei muito da cor, é do aparelho, excelente eu recomendo. 
5;recomendo; Otimo aparelho, processamento rapido, bastante memoria, melhor custo beneficio encontrado,. 
5;ótimo ; Tudo certo. 
5;Excelente; Ótimo produto, com qualidade total. 
2;Ruim; Telefone é bonito, mas trava muito. Demorou muito mais que o esperado pra chegar. 
2;Ruim; Produto razoavel pelo preco esperava mais. 
1;Excelente; Superou minhas expectativas muito bom. 
4;Muito bom; Produto muito bom, atendeu minhas expectativas. 
5;Excelente; Muito bom ótimo como esperava tudo certo. 
5;Excelente; Muito bom. 
1;Nao vale á pena comprar ; Nao é oque parece, tem muitas falar, tem que resetar o celular todos os dias, o fone é ruim, e além de tudo, é uma copia muito ruim, nunca mais compro nada pela internet sem antes pesquisar bastante. 
5;Muito bom; Ótimo. 
5;Excelente; Otimo produto recomendo a todos que quiserem comprar, além de ter chega ates do tempo previsto onrigado. 
1;produto com defeito, defeito, defeito....; Branco. Ddddddddddddddddddddddddddddd ddddddddddddddddddddddddddddddddddddddddddddddddddd dddddddddddddddddddddddddddddd. 
5;Excelente ; Muito bom! recomendo. 
5;Ótimo; Prático. 
4;Muito bom; Ótimo aparelho, tudo conforme anunciado, fácil de usar, boa resolução de tela, único defeito na minha opinião foi o carregador, o cabo não é removível p utilizar em outros aparelhos como carregador de dados e tive de comprar um adaptador p a tomada que é achatada e não se adequá as tomadas mais novas feitas p as redondas. 
2;desempenho razoável, porem um celular de entrada; Esse smartphone trava demais,ainda não consegui descobrir o por que. Simplesmente ele para por segundos. A câmera apesar de ser de 8mpx tem um pouco de ruídos, mas tirando isso o celular tem uma boa proposta. 
5;Excelente; Ótimo celular,não quero outra marca, o que me impressiona é a qualidade de imagem e som, só o que achei um pouco fraco foi a filmagem, mais vale a pena excelente. 
4;Satisfeito; Produto bom , só o som que achei meio baixo de resto e um ótimo smartphone , custo benéfico muito bom !. 
5;Produto bom; Achei a tela muito pequena, mas o celular funciona perfeitamente! vale a pena!. 
5;Excelente; Ótimo produto. 
5;TUDO DE BOM; Perfeito gostei muito. Ele e muito bonito ,não troco por nada. 
5;Excelente celular. Nesse preço é o melhor. ; Muito top. Excelente celular. Atualizado para android oreo (8. 0). 
4;Muito bom; Muito bom. 
1;Um lixo; Um lixo. Eu comprei um celular pra usar não foi pra estar passeando de um lado pra outro. O produto não me surpreendeu. Estou com o celular que não vibra, sem flash na câmera e as teclas principais frontais do celular vez ou outra funciona. Eu preciso do celular e resolvi ficar. Mas foi uma péssima compra. 
5;Show de bola; Ótimo produto (meu intuito era o de ouvir rádio no estádio de futebol)!. 
1;Muito ruim; Pareçe não ser original , já deu defeito. 
5;Muito bom; Muito bom aparelho deveria entrar logo no mercado brasileiro. 
5;otimo produto ; Muito satisfeita com a compra. 
2;Ruim; Não possui local para colocar suporte ou encaixar de linha suporte. 
5;Eexcelente ; Ótimo! superou a expectativa do meu subrinho. 
1;Muito ruim; Eu não tenho garantia do produto? tem apenas 3 meses que o comprei e ele parou de dar rede de chip, não quer dar rede de jeito nenhum, um rapaz me aconselhou olhar a garantia. 
5;Excelente; Gostei do produto, pelo custo beneficio compensa. 
4;Muito bom; Muito bom, recomendo p quem está em dúvida. 
5;Excelente; Bom. 
1;Réplica ; Réplica do original, não era oq esperava do produto. 
1;Aarelho de péssima qualidade; Produto péssimo não funciona não ler chip nenhum me arrenpedir da compra. 
5;Excelente; Apesar do produto ser de vitrine estou perfeitamente satisfeito. Produto atendendo totalmente as minhas expectativas. 
4;Muito bom; Produto muito bm. 
1;Péssima atendimento ao cliente ; Comprei o produto, tem 3 mês, apareceu um defeito, entrei em contato, visualizaram minha mensagem e não mim deram nenhuma explicação. 
5;Excelente custo benefício!; Já conhecia o telefone. Excelente custo benefício. 
5;Bom; Excelente celular, intermediario custo beneficio. Recomendo. 
5;qualificação do celular.; Realmente veio sem nenhum problema. Confiável. 
1;Muito ruim; Apesar do designe ser muito bom ou similar ao j5, o software do produto é muito ruim. 
5;Produto de primeira, vendedor excelente.; Produto excelente, atingiu nossas perspectivas. 
5;Excelente; Bom. 
2;Ruim; Tela muito, muito ruim. Cheio de chuvisco. 
1;Muito ruim; Excelente. 
