1;lixo, enganação ; Um lixo, o produto nao funciona e nao querem devolver meu dinheiro. 
5;M5 simplesmente top; Perfeito tudo que eu estava procurando. 
1;Muito ruim; Celular deu problema no terceiro dia e não responde minhas mensagens. 
4;Muito bom!; Tirando o fato de que o android ainda é 5. 1. 1 o telefone é um ótimo custo-beneficio. Ademais, a lenovo informou que em próximas semanas já haverá atualização para o android 6. 0 o que o fará ainda melhor. 
5;Excelente; A câmera tira fotos perfeitas, tanto na câmera traseira quanto na frontal. Excelente!!! amei!. 
2;Show; Ótimo. 
2;Achei muito bom só faltou a nota do produto...; Produto sem nota isso me preoculpa do resto o celular e excelente. 
2;Prazo de entrega não cumprido; Estou esperando ele chegar, pois os dois prazos que deram não foram cumprido. Chato, neh?!. Tomara que chegue logo!. 
5;excelente; Ótimo. Tenho o modelo antigo que funciona até hoje. Este modelo melhorado com 2 chips e o ideal para um telefone leve, durável e que pode ser usado nas piores condições. Ótimo produto e preço. Vale muito a pena ter um desses. 
5;Satisfação!! ; Produto excelente!!! super satisfeita, celular não trava, não aquece, fácil acessibilidade. Melhor custo benefício!!. 
1;Muito ruim; Não funciona. Péssima qualidade. 
5;Excelente; Qualidade qualidade qualidade pura muito bom. 
2;Ruim; Nao gostei amemoria marca 8g mais nao tem espaço pra nada. 
1;nao recomendo; Nao gostei nao veio xiaomi not 4 x mais sim xiaomi not4. 
2;Razoável ; Razoável. Câmera trava. Mais pelo preço era de se esperar. 
4;Muito bom; É básico mais atendeu bem as minhas espectativas. Recomendo!. 
5;Gente é sensacional.; Para quem deseja um celular resistente, com excelente bateria e funçoes basecas e necessárias, é este o aparelho que precisa adquirir. Principalmente para quem trabalha muito ao telefone e também em obras é este mesmo, ele tem tudo que necessita, é forte, bonito, bateria excelente, pode cair, além dessas qualidades tem também lanterna. É tudo. 
5;recomendo; Otimo produto,correspondeu a espectativa. 
5;Excelente!; Excelente compra! produtos muito bons. 
2;Ruim; Celular muito lento, não cabe nada!. 
1;Muito ruim; Nao gostei. 
4;Celular bom ; Muito bonito e com bom desempenho mas é ruim de sinal. 
4;E um aparelho razoável; Bom. 
1;Nao indico o produto.; Horrível,trava,desliga,as pessoas nao me escutam perfeitamente,etc. 
4;Muito bom; Produto de ótima qualidade!. 
1;Ruim; Lixo de telefone não índico ninguém compra. 
5;Excelente; Celular top! pelo valor é impossível achar um melhor!. 
1;Recomendo a todos; Bom, muito legal!. 
5;Bom produto; Bom produto. Pega bem no sítio e tem garantia de um ano. 
2;Ruim; Olha eu não gostei não tenho certeza mas me parece ser um produto de segunda linha pelo pouco tempo de uso estou insatisfeita. 
1;Vou processar muito ruim; Uma porcaria liga e desliga sozinho vou processar. 
1;Muito ruim; Produto de péssima qualidade não recomendo !!. 
1;Desapontado; Dois primeiros dias funcionou normal, porem ele vive reiniciando, segundo um tecnico ele esta com defeito no software. 
4;Muito bom; Muito bom!. 
4;Ótimo design; Recomendo. 
2;Sansung J1 mini ; Fazendo uma ligação, ao encostar no ouvido, o aparelho continua ligado ele não apaga automaticamente como outros modelos até mais inferior. Consumindo mais bateria. 
5;Ótimo custo / beneficio ; Excelente celular! tive várias indicação boas e agora usando constatei que o produto realmente é um ótimo custo/beneficio. Seu design é muito bonito e a usabilidade ótima. Recomendo!. 
1;Mais ou menos ; Só um veio em ótimo estado o outro veio quebrado. 
5;Atendeu as minhas expectativas; Bom e só que tenho p dizer só isso. 
5;Excelente; Excelente aparelho, mudanças significativas ao meu ver em relação ao motog5, interface, câmera, desempenho, etc. A tela maior e a menor espessura também são um belo atrativo, bem próximo das linhas superiores, moto x, moto z. Ótimo custo benefício, para quem não costuma pagar mais de 1000 reais em celular. 
5;Excelente; É um celular bom recomendo para quem quer um básico. 
1;Muito ruim; Sem avaliação,pois, o produto estava com defeito. 
1;Péssimo!!; Não gostei, ja tive fone da philips e esse não tem nada a ver com original. 
1;uma porcaria é falso; É uma porcaria falso foi dinheiro jogado no lixo fiquei no prejuizo não durou nem 4 meses estragou,levei pra concertar não consegui pois descobri que ele é falso. Só dei uma estrela pra conseguir opinar. Resumindo é uma porcaria. 
1;Péssimo smartphone!; Infelizmente esse smartphone da blu é de péssima qualidade, não se enganem com o visual bonito, pois, apresenta vários problemas. 
1;Bateria viciada; A bateria viciada n dura 1 dia a minha bateria oq eu faco?. 
1;Falsificado ; Vei faltando manual nota fiscal , nao tem volume , na verdade e uma replica , estava dizendo ser original e nao e !!. 
1;Eu não fiquei muito satisfeita; Eu não fiquei muito satisfeita pois o produto não veio igual ao da imagem. 
1;Uma merda; Uma merda ,trava muito e fica reiniciando toda hora e eu não sei si e um pobrema,. 
5;Excelente Aquisição; Perfeito, em material, acabamento e operacional. Excelente aquisição. Muito feliz com minha compra, totalmente eficiente. Até agora nenhum problema com meu aparelho. 3/32 é ótimo e melhor do que qualquer celular na mesma faixa de preço. 
5;Muito satisfeito; Excelente sem comentários. 
2;Otimo ; Produto ótimo excelente bombombom. 
5;Bom produto. Custo beneficio incrível!; Bom produto. Custo beneficio incrível!. 
5;O melhor celular que tive; Perfeito! amei imagem top a memória 64g. 
4;muito satisfeita; Produto de boa qualidade. Ótimo para idosos, números grandes no teclado e no visor, toque alto. Fácil manipulação e didático para uso. Tamanho grande do aparelho o que facilita manuseio. 
4;EU GOSTEI; Muito bom. Produto simples,prático e eficiente. 
4;Muito bom; E um bom aparelho. 
5;Muito bom; Excelente aparelho! bem fino e leve, rápido, e com câmeras muito boas. 
4;Muito bom; Bom demais. 
5;Excelente; Maravilhoso!! tudo correto. Produto de excelente qualidade. Em perfeitas condições,original! super recomendo!. 
1;Muito ruim; Otimo. Superou minhas espectativas. 
2;Ruim; Só queria saber como faço ele parar de apitar (som de sirene) pois do nada ele faz isso. 
1;Muito ruim; O produto apresentou problema na primeira semana de uso, tive q devolver ao vendendor e o mesmo não me deu resposta nenhuma. Queria um novo produto mais não tive êxito. Vendendor de mal qualidade. Agora em relação a equipe do site mercado livre estão todos de parabéns. Pois me deu toda assistência que eu precisava e devolveu meu dinheiro de volta. Só fiquei insastifeita em relação ao vendendor. 
5;Excelente; Top muito bom. O melhor que já tive. 
2;Ruim; O produto é bom , mas a case que veio com o produto n é a correta. 
1;PÉSSIMO O PRODUTO; Boa noite !! não gostei do produto, porque o mesmo não é original, pois tenho um lg trichip e verificando as configurações, não tem nada haver um com o outro, péssima !!! e não recomendo. Eu não recomendo este produto e jamais colocaria estrela. . . Tenha uma boa noite, edneia. 
1;HORRÍVEL ; Horrível, camera péssima, trava nos apps, e ainda risca só de ficar no bolso, ele está tão riscado atrás que parece que todo dia cai no chão, de tanto que risca fácil. 
5;Incrível; Produto excelente, configuração incrível, ótimo custo benefício, vale cada centavo, camera excelente pela faixa de preço. 
5;Muito bom! ; Muito bom! ! ! !. 
4;brincadeira aparte muito bom.; O celular muito bom,da pra joga,bate foto, assistir filme, da até pra faze ligações e receber. Kkkkkkkkk. 
1;DESONESTIDADE TOTAL; Me mandaram um produto usado! desonestidade total! acessórios de péssima qualidade. 
1;Produto ruim inferior ao fabricados no Brasil; Produto de qualidade ruim não se compara o que era produzido no mercado nacional. 
4;Muito bom; Por enquanto está tudo ótimo, a principio é um pouco complicado de mexer, mas logo aprende e descomplica. Ótimo produto. 
1;Péssimo, não faço mais negócio.; Muito ruim, produto arranhado e quebrado o carregador. 
5;Excelente; Bom produto, atendeu a minha necessidade. Recomendo o site de vendas e o produto. 
2;Produto fraude não comprem nem indiquem!; Produto de baixa qualidade promete um performance que não consegue cumprir começou a travar com duas semanas de uso se realmente eu não precisasse para trabalho queria uma devolução pq joguei dinheiro no lixo. 
1;Muito ruim; Muito ruim. 
1;Muito ruim; Só mente ruim. 
1;Fraco de aplucativos; Ruim demais. Não tem o botao do menu. Pensei de ser bem melhor. 
1;Ótimo ; Muito bom,otimo meu filho amou,bom aparelho,eu recomendo. 
1;Celular ultrapassado; Vale nada, não indico a compra. 
5;Excelente; Produto muito bom. 
5;Satisfeito com o vendedor...; Excelente qualidade minha filha adorou. 
5;Excelente; Excelente aparelho, é o segundo que compro, recomendo!. 
5;Gostei. É simples mas funciona bem; Já tem mais de 6 meses que comprei e está tudo funcionando normalmente. Vem pouca memória, mas é só colocar cartão. Veio com muita propaganda, mas formatei e sumiu tudo. A câmera não é muito boa mas no geral atendeu minhas necessidades. 
1;Bom; Bom celular, estou satisfeito. 
2;Gostei; Mt bom. 
2;Ruim; Não é bom, veio com defeito e vou trocá-lo. Magno. 
4;Muito bom; Produto de boa qualidade. 
2;Ruim; O produto e bom mas a câmara deveria ser melhor, as músicas que eu baixei no aparelho não consigo colocar no cartão sd. 
5;Excelente; Muito bom, só a bateria que deixa a desejar!. 
4;Parabéns otimo; Bom custo benefício. 
1;NÃO COMPRE!; O aparelho é bonito, só que a conexão do segundo chip não funciona e agora? o que faço?. 
5;Excelente; Produto de excelente qualidade, impressionante a resolução, velocidade de processamento. Recomendo. 
1;péssimo produto nao comprem; Produto sem nota fiscal, apresentou defeito e émuito ruim, acredito que seja produto de roubo ou furto. 
1;Muito ruim; Produto ruim. Microfone ruim, com chiado e carregador que não funciona. 
5;Excelente; Super satisfeito com o produto e recomendo a todos que como eu precisa de sinal em uma zona rural. 
2;Ruim; O volume é normal e como idoso tem deficiência auditiva acho o volume deveria ser mais alto. Do resto um telefone normal. 
4;Interessante para quem gosta de redes sociais.; Só não é muito bom para jogos pesados. 
1;Muito ruim; Produto veio com defeito e o lacre não era original. 
2;Ruim; Mais ou menos, descarrega rápido, todo dia tem que carregar umas 4 horas. Tv nem se quer pega chiando. Camera muito boa. 
1;Excelente qualidade muito bom ; Um produto muito bom de alta glalidade recomendo para todos. 
1;Idoso arrependido; Celular razoável aparelho ligado sem fazer uso bateria descarrega em menos de 36 horas estou meio arrependido vou usar meu velho celular l. G que com mais de 10 anos bateria dura 7 dias. 
4;top!; Top!. 
1;Ruimmmmmm; Ruim tem um chip apenas, e muito fraco essa versão, não veio nota fiscal, trava bastante péssimo não compraria de novo!. 
5;Excelente; Acho que é bom, só falta a garantia é o manual. 
1;Horrivel; Horrível. 
4;Muito bom; Aparelho muito bom de sinal,funciona até sem antena externa num lugar que não pegava nada,bateria com ótima autonomia. 
1;Pessima compra.; A bateria acaba em tempo abaixo do mínimo. Foi o pior presente que já dei. Estou muito arrependida por ter efetuado a compra. 
1;NÃO VALE NEM 100 REAIS, NÃO COMPRE!!!; Trava só de pensar em mexer na tela, bateria não aguenta 1 dia de uso, para instalar um aplicativo simples como whatsap precisei reiniciar umas 3 vezes pq travou, pra si ter uma ideia ele trava quando muda de uma cidade para outra rs, não recomento nem pra dar a um bebezinho, pq até ele vai passar raiva. 
5;Excelente; Otimo produto. 
5;Lindo designer bateria de longa duração ; Produto maravilhoso !!!!!recomendo satisfação 100%. 
5;Muito bom; Produto muito (bom) excelente. 
5;Excelente; Boooom. Recomendo. 
4;Smartphone Celular Blu Studio C Hd Android 5.1 Tel; Produto dentro das especificações anunciadas. 
5;é 10 !!!!!!!!!!!; Muito bom esse produto estalei pega muito bem nota 10. 
4;Muito bom; Muito bom não trava muito e não esquenta. Ótimo para uso do dia a dia. 
5;Excelente; Ótimo. 
5;Telefone atende muito bem; Muito bom, excelente telefone da motorola. 
2;Ruim; Não gostei da cor que veio eu comprei. Branco e veio preto fiquei ensastifeito. 
1;Parou de funcionar em menos de um mês!; Horrível, tem que configurar/habilitar manualmente a internet, no meu (tim) consegui fazer funcionar apenas o 2g, e o pior de tudo, em menos de um mês, sem cair, sem molhar, repentinamente parou de funcionar e não dá qualquer sinais de vida! ou seja, estou sem celular. Baita desperdício de dinheiro. Completamente insatisfeito. E vejam só, não emitem nota fiscal!. 
2;Pelo preço é uma porcaria; Bateria não dura um dia inteiro. Lente da câmera traseira quebra fácil basta colocar em cima da mesa pra quebrar. Se precisar trocar alguma peça pode esquecer pq não acha. 
5;otimo,dentro das especificações; Conforme descrito. Bom aparelho. 
1;Muito ruim; Não achei um aparelho mto bom. Mas da pro gasto. 
5;O celular é muito bom.; Adorei,o celular é muito bom. 
1;Muito ruim; Fiquei muito aborrecida, pq já está com defeito, como fazer para garantia?. 
5;Excelente; Ótimo aparelho para quem tralha em serviço pessado porque é resistente a quedas e também tem um som excelente recomendo a todos do ml. 
5;Excelente; Otimo. 
1;Muito ruim; Horrível. 
1;Muito ruim; Nada bom não tem nota fiscal péssima compra. 
2;Talvez defeituoso.; Devolvi porque não funcionou com chip4g nem 3g. 
5;Exelente; Ótimo produto super resistente tem um volume muito bom bateria de longa duração. 
5;Excelente; É um celular muito bom e gostaria de comprar outro por melhor preço pois já sou cliente. 
5;Excelente; Otimo produto. Otimos negociantes. Tudo nos conformes!!!!. 
2;Ruim; Não gostei. 
5;Excelente; Até o momento não tenho como reclamar,superou minha espectativa. Espero que tenha resistência. 
1;Produto nao funciona .. quero devolver; Produto nao funciona. Quero devouve-lo. Assim que resolver qualifico como positivo. 
2;Bom; Bom. 
5;Recomendo o vendedor de mais.; Gostei e recomendo celular simples de se manusear. 
2;Ruim; Pouca memoria interna e não se consegue passar nada para o cartão de memoria me arrependo de ter comprado. 
5;Muito bom. Recomendo. ; Muito bom. Estou com ele há quase 1 mês e está tudo bem. 
5;Um dos melhores; Muito bom o produto! xiaomi uma marca que confio. 
5;Maravilhoso ; Maravilhoso , super recomendo. 
1;Pessimo; Porcaria o carregador e uma toma la dos eua. 
1;Pessimo; Não gostei péssimo não recomendo passei 5 dias com ele e ele apagou e tela e não respondeu mais. 
5;Ótimo Aparelho; Ótimo aparelho, bem fino, roda rápido e sem frescuras. O que não gostei foi o slot híbrido, aí tem que optar por ter dois chip ou um chip mais um cartão, o custo x beneficio é ótimo. 
2;Dexia MUITO a desejar.; É um celular descartável, por assim dizer. A memória interna é ridiculamente minúscula. É muito limitado. Mas o que esperar de um celular de r$ 200,00? a não ser que o telefone seja usado única e exclusivamente para se usar para fazer ligações, não vale a pena a compra. 
5;Muito bom ; Ótimo muito bom recomendo mesmo. 
2;Ruim; Parece ser imitação. 
5;Excelente; Gostei, recomendo muitooooooooooooooooooooooooooooooooo. 
5;Para a finalidade que eu adquiri, está perfeito!; Para a finalidade que eu adquiri, está perfeito! a bateria dura sim! é óbvio que você não vai querer a qualidade de um iphone num aparelho desse, né?. 
5;Excelente; Ótimo produto, estou contente com a compra. 
2;muito bom; Muito bom. 
1;Muito bom odorei; Cinco 3 estrelas muito obrigado meu filho adorou muito parabéns. 
2;Achei o produto fraco ele está com problema ; A marca em si ê boa mas o celular está travando já travou várias vezes não sei o que está acontecendo. 
5;Muito bom recomendo ..; Celular bom recomendo. 
1;Muito ruim; Pessimo aparelho trava mais que fica bom nao aconselho ninguem a comprar o valor dele de de entrada em um bom que vale mais. 
5;Excelente ; Muito bom, tudo certinho. Ótimo aparelho. 
4;Perfeito; Gostei,apesar de não vir o fone de ouvido,mais gostei e super recomendo. Ótimo produto. 
4;Muito bom; O celular e um aparelho que realmente estava esperando. 
1;Não é original; O carregador não é original. Conectado ao j5 duos 4g, aparece a mensagem de "carregamento lento do aparelho. Para carregar mais rápido, use o carregador original". 
4;Muito bom!; Em relação custo benefício, é bom e compensa!!!. 
1;Muito ruim; Uma porcaria. A bateria não dura nem 5hs. Trava muito!!. 
1;Muito ruim; Nao possui letras grandes e o teclado e pequeno,ñ tem a opção de falar oque esta sendo digitado. 
1;Produto veio consertado com 2 dias deu problema.; O produto não veio novo veio consertado e tenho fotos que provam isso com etiqueta de conserto no celular, não veio com o lacre original da lenovo na caixa e veio com um carimbó na parte de dentro na caixa escrito testado, com 2 dias de uso deu problema no celular. 
5;boa compra; Bom, produto, um pouco baixo o volume. 
1;Muito ruim; Produto pirata. Tive um anteriormente e é totalmente diferente do original. A bateria não dura nem 1 dia (praticamente sem usar). Quero reembolso!!!. 
2;Decepcionada ; O celular trava demais, se está com rádio ligado não consegue usar mais nenhum aplicativo, e fica constantemente sem sinal da operadora comprei de uma só vez dois celulares e todos dois fica com o mesmo problema, não recomendaria esse produto. 
5;Ótimo Produto e Atendimento.; Òtimo produto, tudo dentro dos conformes! recomendo!. 
1;Fiscalizar mais a fundo o produto a ser enviado ; Venderam um produto com defeito uma porcaria ??. 
5;Eu indico podem comprar; Ótimo!! do jeito que eu queria tudo certo. 
4;recomendo a todos do ml; Produto de ótimo custo beneficio atende os requesitos minimos. 
1;Sem Nota Fiscal; O produto veio sem nota fiscal,e agora o celular deu defeito e eu pedi ao verdedor joel pra mim mandar a nota fiscal e ele me bloqueou e apagou a pergunta,agora não tem como eu mandar pra apple pra consertar. Perdi meu dinheiro!. 
5;Ótimo custo-benefício.; Produto é bom, instalo tudo que preciso nele e não esquenta. As vezes da uma travadinha rápida mas nada demais. 
4;Muito bom; Ele e muito bom dentro do esperado. 
5;Produto atendeu as expectativas! Recomendo!; Produto atendeu as espectativas! rápido e prático! o melhor em custo benefício!. 
2;Memória Externa com defeito; A câmera não foi muito satisfatória, em se tratando da selfie que apesar de bons recursos as fotos naturais saem pálidas (descoradas) exigindo mais cuidado que as comumente usadas anteriormente por mim. O outro que acredito que veio com defeito foi a memória externa, já coloquei comprei e utilizei dois cartões de memória e não consigo salvar nem músicas e nem fotografias. A princípio ele salva, porém depois de algumas horas as fotos não abrem e as músicas com mensagens de que não podem abrir aquele arquivo. Utilizei o mesmo cartão em outros aparelhos funcionam. Tentei salvar no computador usando o cartão com adaptador. No computador funciona, jã no lg k10 novo não funciona. Já na memória interna do próprio aparelho funciona normalmente tudo. Não devolvi pra troca devido ao tempo, e eu utilizo muito em meu trabalho, moro no oeste do pará, no mínimo uns vinte dias. Preferi ficar usando só a memória interna. Daí minha avaliação ruim. 
5;muito show ; Muito bom super recomendo vale apena comprar. 
5;Ótimo aparelho!; Nunca achei que um celular chinês fosse tão bom, este aparelho está virando febre entre meus amigos por ter um custo x benefício excelente, digo com certeza que se estiveres em dúvida de qual aparelho ficar, fique com este!. 
5;D++++++++++++++++++++++++++++++++++++++++; Excelente celular com muita tecnologia e performasse, além de designer lindo com um custo benefício de dar inveja. Simplesmente d++++++++++++++++++++. 
5;Muito bom; Excelente produto bom original recomendo para todos este produto excelente. 
1;Péssimo o aparelho ; Então com 15 dias usando o celular ele travou a tela só fica com o nome positivo estou tentando uma autorizada mais prefiro devolver o produto e vcs me ressacir nem usei o celular já parou de funcionar. 
2;duvidoso; Celular muito bom , mas vem sem fone e sem nota fiscal trocando em miudos ser der pau fico sem celular. 
2;Optei por outro modelo Dash x2; Terminei trocando pelo modelo dash x2 (um pouco mais caro) mas nao recomendo o modelo dash x2. Memoria quase travando msm sem instalar aplicativos e muito menos jogos. 
1;Muito ruim; Uma estrela porque para continuar tinha que marcar uma,se não seria zero, péssimo. 
4;Muito bom; Funcional e resistente. 
1;N gostei; O meu deu defeito com 2 meses a tela fica piscando e onde encaixa os isnep oxidou com o calor da minha mão mesmo com a capa. 
5;Satisfeito com o J7 Metal; Aparelho muito bonito, de qualidade. Não trava nenhum aplicativo e desenvolve muito bem a execução de vídeos. Já a 2 meses comigo e não apresenta defeito. 
1;Muito ruim; Ruim. 
5;Melhor custo benefício da categoria!; Melhor custo benefício da categoria, lindo esteticamente, ótimo desempenho, câmera traseira muito boa, câmera frontal mediana, android puro. Resumindo, recomendadíssimo!. 
1;Muito ruim; Celular muiti ruim num carrega nao funciona direito. 
2;Ruim; Não gostei !!! o celular tranca ao finalizar a chamada, tem que remover a bateria pra destrancar. As funções são limitadas em comparação aos modelos anteriores. Enfim um celular caro e ruim. Vou colocar o meu a venda. 
1;Pessimo!; Muito ruim !na verdade comprei por que nao sabia que seria uma replica ,muito lento ,esquenta de mais ,nao segura carga na bateria ,tem que ir para o carregador umas quatro vezes ao dia ! ja mais pensei comprar um produto que nessas condicoes,estou inteiramente insastifeito!. 
1;Maravilhoso ; Ótimo muito bom excelente recomendo. 
4;Muito bom; Gostei. Para quem quer só usar internet e ver vídeo. 
1;Ótimo ; Eu adorei o produto, eu recomendo!. 
5;Produto ótimo ; Ótimo leve, os aplicativos abrem rápido. 
4;Otimo aparelho; Adorei o aparelho! rápido, não trava, cores brilhantes. Muito bom mesmo. Só a tampa não fecha bem com a bateria colocada. 
1;Parou de funcionar quando ele acabou a bateria; Veio funcionando quando acabou a bateria ele desligou e não ligou mais,não carrega o celular e não funciona. 
2;Maravilhoso; O celular é muito bom excelente. 
1;Decepção; O produto nao é original! fiquei muito decepcionada!. 
1;Muito ruim; Aparelho recuperado !. 
5;Excelente; Muito bom. 
4;Produto bom; Ótimo produto, bonito, leve. Bem satisfatório. Cor bonita. Agora é só desfrutar do novo aparelho. 
5;Excelente; Produto original e de ótima qualidade. 
5;Ótima escolha .; Ótima opção para presentear. 
5;Maravilhoso em tudo estou amando!; Excelente. Produto uma câmera ótima!. 
1;Estou bem satisfeito, obrigado.; O aparelho veio tudo certinho, lacrado. 
1;Vendedor honesto ; Ótimo produto muito bom segunda compra e estou satisfeito. 
2;Ruim; O celular n atendeu minhas expectativas. 
4;Muito bom; O celular e muito bom. 
1;Não gostei; Não gostei produto de péssima qualidade,não estava funcionando direito. 
1;Compra Ruim!; Já vem de fabrica com mais aplicativos que suporta, e como o aparelho tem memoria interna insuficiente, nada funciona, apre uma aplicativo trava todos os outros. Não permite a instalação de nenhum outro aplicativo por falta de memoria, não permite apagar, não permite nada. Pra quem não vive neste mundo, ou não usa celular, internet, redes sociais etc é um excelente aparelho. 
5;EXCELENTE; Excelente produto, tudo conforme o anunciado, pode comprar sem medo. 
2;Infelizmente o microfone é pessimo.; Ninguem te escuta! prepare-se pra gritar muito alto. 
1;Não gostei ; O produto não é original e já deu problema com menos de 15 dias de uso. 
1;Muito ruim; Pessimo produto, não recomendo. 
1;Muito ruim; Infelismente o produto veio com problemas,nao recomendo o momento. 
1;Muito ruim; Depois de um mês e meio o produto apresentou defeito fica reiniciando sozinho direto. 
1;Pessimo; Pensei que era original. Mais é réplica. Não gostei. 
1;Muito ruim; Os acessórios não são originais. 
5;Excelente; Ótimo produto. 
5;Excelente; Produto de otima qualidade. 
5;Excelente; Muito bom excelente mesmo se tivese mais estrelas daria. 
1;Ruim; A câmera n tem foco. E ele n é original. Propaganda enganosa. 
4;Muito bom; Produto bom bateria dura quase uma semana. 
1;Se nao devolver o dinheiro vou denunviar; A seguradora se nega a fazer o srguro porque nso tem nota fiscal. E agora. 
1;Muito ruim; Made in china, modelo segunda linha. 
1;Muito ruim; Tela com toque muito lento e arrastado. Péssimo. Quebrei e joguei no lixo,. 
1;Nao deu e nao deu como que nao deu mais ainda vai ; Ruim nao venho com a senha da configurações do aparelho. 
1;Ótima ; O produto e ótimo e tem um excelente funcionamento. 
1;arrependimento de ter comprado; Só gostei do tamanho ,o resto nada presta parece ser falsicado ,trava muito. 
2;o meu aparelho e péssimo só este que já veio defei; O meu esta travando eu tenho que tira a bateria depois colocar pra ele voltar ao normal já pensei em jogar contra a parede de raiva bem na hora que mas preciso que ele trava ok. 
5;Telefone top; O telefone é ótimo te umando bom custo beneficio. 
