1;Telefone horrível, perdi meu dinheiro! Ñ comprem!!; Telefone péssimo, perdi meu dinheiro. Estragou em um mês de uso, teclado descascou, não aceita os 4 chips simultaneamente, o teclado tem teclas que não funciona e, por não está ligando. Perdi meu dinheiro, não sei a quem recorrer por garantia. 
4;Bom produto. Só o viva voz é baixo ; Gostei, funciona bem. Só o viva voz é baixo. 
5;Muito bom obrigado; Excelente, atende as necessidades vou comprar outro p minha mãe um presente p ela. 
5;Muito bom ; Produto de otima qualidade !. 
5;Excelente; Muito bom. 
5;Excelente; Muito bom. 
5;Ótima compra!; Produto de ótima qualidade. 
5;Recomendo!!!; Muito bom o produto!!! foi o q exatamente esperava. 
4;Muito bom!; Muito bom! até o momento não tenho nada a reclamar desse smartphone. 
5;Maravilhoso e lindo com uma qualidade excelente ; Ótimo de excelente qualidade, não trava e é lindo. 
4;Muito bom; Otimo produto. 
5;Excelente; Otimo produto! tudo ok! perfeito! recomendo a todos!. 
5;Excelente; Top! excelente produto! tudo ok. 
5;Excelente, ótimo custo benefício, recomendo!; Ótima estética, performance e preço, melhor do que qualquer modelo nesta faixa de preço de marcas tradicionais aqui no brasil. . Recomendo. 
5;Excelente; Dentro das minhas expectativas. 
2;Ruim; Não gostei,veio com problemas defeito,pra mandar de volta ainda tive que pagar os gastos com correios. Espero que de certo de receber um novo aparelho o qnto antes, mas de outro modelo. 
5;Nota 10; Excelente produto, vale nota máxima 10. Bem elaborado supera todas expectativas merece ser top. 
4;Muito bom; Muito bom aparelho. 
5;Excelente; É um excelente aparelho. 
4;Muito bom; Bom recomendo para idosos por ser letras grandes. 
1;Muito ruim; Produto com defeito. 
5;Excelente; Celular muito bom. 
4;Muito bom; Produto atende as expectativas a que se propõe, mesmo existindo produtos de tecnologia muito superior no mercado ele atendeu ao objetivo que eu desejava. 
5;Bom para o valor; É excelente. Leve funciona corretamente. 
1;Muito ruim; Não é original ! por isso não recomendo. 
4;Muito bom; Bom produto. . Tudo dentro dos conforme. 
5;otimo; Muito bom, gostei super simples e bonito. 
2;Não achei muito bom esse produto péssimo dele bom ; O produto não é essas coisas trava muito eu não compraria outro. 
1;Produto importado e de má qualidade, não recomendo; Produto importado e mar qualidade. 
1;Muito ruim; Produto de pessima qualidade, não pega o ponto do teclado e tem problema com chipe de internet, tela de toque não funciona direito. 
1;Muito ruim; Uma merda! trava tanto que para vc abrir uma janela leva quase o dia todo e quando vc consegue fazer alguma coisa ele trava dnv. É um celular quebra galho. Se vc tem paciencia ele ate quebra o galho, mais se vc nao tem, vc taca na parede. 
5;Excelente; Ótimo celular, resistente e durável. 
1;Muito ruim; O produto está bom mais o carregador explodiu. 
2;Nao gostei; Na primeira semana amei mas depois me decepcionado trava a tela nem p desligar não dava tinha que tira a bateria vendi me encomodei o fone não pegava nenhum horrivellllll. 
1;Ruim; Produto frágil e a bateria descarrega muito rápido. 
5;Ótimo aparelho!; Interface fluida, que até agora não travou. Com duas atualizações já estou com o miui 9. 1. 1. 0, android 7. 1. 2. O mais legal da os dele, customizada pela fabricante, é a possibilidade de desbloquear os aplicativos por meio de senha ou digital. Isso ajuda muito pra quem não gosta que outras pessoas olhem o whatsapp e outros aplicativos de mensagem. 
5;Excelente; Bom , tudo ok. 
1;Ruim; Produto apresenta várias defeitos, com pouco tempo de uso já começava a travar, agora o microfone as vezes não funciona, a pessoa do outro lado da linha não escuta o que está sendo falado. Não gostei. 
2;Ruim; Não gostei porque as configurações do perfil, chamada e agenda não dá opções de mudança. 
2;Nada consta.; Regular, não gostei muito. A marca eh boa, mas o modelo não me convenceu. 
2;....; 
5;Excelente; Excelente produto,me surpreendeu. Superou minhas expectativas. 
1;Uma roubada gostaria de poder cancelar ou devolver; Uma porcaria, trava nao baixa nada desliga wifi, não atualiza, fica preta as paginas do nada e estou escrevendo do tel de minha filha pois ele nao abre essa pagina. Pior que isso nao baixa watsap dinheiro no lixo. 
5;Satisfação; Tudo certo. Produto até agora funcionando conforme definições. 
2;porque demoram tanto pra devolver o dinheiro?....; Melhor eu ficar quieto e esperar receber o dinheiro de volta. 
5;ótimo produto e excelente vendedor; Produto de excelente qualidade, funcional e indispensável. 
5;legal; Gostei cumpre que promete, pelo valor ta bom agrado. 
4;Bom custo benefício.; Bom custo benefício. 
1;péssimo.; Muito lento trava toda hora horrível. Não recomendo este produto. 
5;Excelente; Muito bom tudo funcionando perfeitamente! !!!. 
1;Nao agradei; Não foi como eu esperava,não agradei. 
2;Já está dando defeito o aparelho.; O celular já está apresentando problema com pouco tempo de uso, quando vc aperta o botão pra ligar a tela a tela fica branca e demora um tempo pra aparecer imagem. 
1;CELULAR -ORRO-; O produto é um similar do moto g, não consigo baixar aplicativos = wattsapp. Não observei no ato da compra que era um orro (chinês). 
1;Ruim; Ruim trava direto e não serve para uso. 
2;Existe melhores opções no mercado por esse preço; Devido a lenovo ser a atual proprietária da motorola acreditei ser de qualidade, porém o produto deixa muito a desejar, tem o mesmo vício de seu irmão de produção moto g5, touch fantasma com menos de 3 dias de uso, desempenho mediano, abre 3 aplicativos e o celular não roda fluido, fica meio enroscando, a configuração no papel não corresponde em desempenho esperado. 
5;Excelente; Otimo recomendo. Produto de qualidade. 
1;Os periféricos são Ruim, o aparelho é ótimo.; Os periféricos são ruins. O brinde tela de vidro veio quebrada e o adaptador para o carregador veio com o pino quebrado. O aparelho é ótimo. 
1;Muito ruim; O telefone que pedir não veio. Veio outro. 
5;Vale muito a pena.; Muito bom aparelho. Superou as espectativas. 
5;Muito bom; Produto muito bom, ótima qualidade, recomendo!!. 
2;Produto bom; Produto bom, mas não é original. 
5;VANTAGE; O celular blu atendeu a minha necessidade e alem disso ele é bem barato. Estou satisfeito. 
5;Melhor compra ; Apple sempre produzindo ótimos produtos ! amei o aparelho perfeito super rápido, tira lindas fotos! bateria excelente ! amando. 
1;O vendedor é show. O celular é fraco.; O produto é bom,pelo preço. Mas se vc estar procurando um celular para seu uso como seu celular pessoal ,nao compre esse. 
5;Excelente; Bom viu, vale a pena!. 
5;RRecomendadissimo ; Muito bom mesmo. Recomendo a todos. 
5;Excelente; Muito bom recomendo esse produto. 
1;Muito ruim; Não gostei o aparelho não tem memória vc receber um áudio no zap ficar dando memória cheia e eu so baixei o zap e o fece e nao adianta colocar cartão de memória. 
2;Trsvs trava muiti e do nada parou de funcionar!; Ele trava muito e o meu depois de 3 meses simplesmente parou!. 
2;mais ou menos; O aparelho veio com uns arranhões fora isso normal. 
2;Ruim; Bom, com poucos recursos. Mas funciona bem. 
1;Muito ruim; Dessa vez nao gostei do produto o caregador nao carega, e muito fragil. 
1;Muito ruim; Um dos produtos apesar de ser falsificado presta o outro é horrivel!!!!! não se entende o que fala e o carregador veio estragado, moro longe ate mandar de volta é o maior transtorno. Fica a lição de comprar o produto sem ter confiança. 
5;Celular bacana; Vale a pena excelente custo benefício. 
5;gostei muinto; Otimo gostei muinto do produto eu recomendo. 
1;Ruim; Comprei e no segundo dia deu defeito riz a devolução e estou aguardando a devoluçao do dinheiro. 
5;Excelente ; Celular excelente, designer show d bola. 
5;produto exelente; Produto exelente. Com certeza pretendo comprar mais. Recomendo a todos. 
5;Muitobom; Produto excelente gostei muito. 
1;nao gostei; Nao gostei do produto , muito inferior. 
2;Ruim; Não é original! o áudio não funciona, nem o despertador além de várias outras coisas. 
5;Excelente; Já conheço o produto, é ótimo, recomendo. 
1;é isso ; O meu veio com problema não compraria outro. 
5;Excelente; Show lindo demais valeu ótimo aparelho rápido. 
5;celular e marca mais que top!; Um otimo produto veio certinho na caixa e tudo original, apesar da demora. O celular com o melhor custo beneficil do mercado livre. 
1;brincadeira, poderia tem avisado.; Brincadeira. Pedi uma cor e me eviaram outra ridicula. Ainda bem que veio direito. 
2;Telefone não atendeu as minhas expectativas; Não gostei do aparelho, pois o som é muito baixo, o menu não é tão amigável e a bateria não dura tanto quanto eu esperava. Por ser um telefone utilizado por meu pai apenas para receber e fazer ligações a bateria não dura um dia inteiro. 
4;Smartphone bom pelo preço.; Smartphone bom pelo preço, bom pra pessoas que usam apenas redes sóciais e jogos intermediário. Bateria aguenta um dia de uso intenso. Recomendo. 
2;Ruim; Nem um dia de uso o aparelho não liga mais, o tempo que eu usei me pareceu um bom aparelho. 
1;Não ; Um montão de estrela eu daria, amei o aparelho é muito bom excelente. 
2;bom produto ; Produto com aparência de aberto novo e bom mais ainda n testei. 
5;Excelente; Excelente produto, muito rápido, nao trava, super recomendo. 
5;Excelente; Por enquanto só sucesso aparelho é show, ainda me aconstumando com as configurações que são um pouco diferentes dos aparelhos que já possui. Mas recomendo. 
5;Sensacional ; Sensacional, estou muito satisfeito com o celular top. 
2;Péssima qualidade de sinal; Aparelho muito ruim. A qualidade de sinal é péssima e não funciona muito bem na maioria dos lugares. O equipamento em si é rezoável. 
5;Um aparelho para ser bem usado.; Smartphone com capacidade de memória compatível com as necessidades do usuário. Tela de bom tamanho, permitindo caracteres bem visíveis. 
4;Primeira linha; Produto muito bom, eu recomendo, execelente custo beneficio. 
4;excelente; Muito bom o produto, fácil instalação gostei muito. 
5;Excelente; Excelente celular, recomendo muito. 
1;Merda; Pessimo não funciona a rede 3g celular funciona apenas 2g. 
5;Excelente; Aparelho muito bom. Recomendo. 
1;Decepção; O cel e bom mais deu um problema aq não quis resolver fiquei descepicionado. 
1;Otimo; Muito. Bom. Recomendo a todos excelente. 
2;Bom; O celular é bom funciona bem mais não foi comprida a promessa do brinde porque o fone não veio e sempre que mandei mensagem que o fone não veio não obtive nenhuma resposta até agora. 
4;Muito bom; Ótimo. 
5;Original, lacrado de verdade! ; Pequeno sonho realisado, realmente lacrado, original, sincronizado via bluetooth com meu iphone anterior, reconhecido pelo macbook e icloud. Tudo certo, muito obrigado !. 
5;Excelente; Produto bom ,,de boa qualidade ,câmera excelente,recomendo. 
4;Show; Meu pai ficou muito satisfeito. Atendeu suas espectativas. 
1;O celular nao tem a melhor camera; Boa noite os 2 celulares nao funcionaram fizeram a troca e continua o mesmo defeito nos 2 sinal que nao tem compromisso. Nota 0 um fracasso. 
5;Excelente; Ótimo celular,gostei muito do produto. 
4;Muito bom; Excelente produto. 
4;Bom; Bom o telefone. 
4;Excelente compra; Gostei do produto muito bom foi o que eu realmente esperava. 
2;Ruim; Muito bom. 
1;Muito ruim; Uma porcaria, não tem modo vibração para chamadas, toque baixo, bateria não dura nada. 100% ching ling!. 
5;Excelente; Muito bom, em ótima qualidade. 
5;Nao tenho o q opinar como não tenho o q reclamar; Ótimo mercadoria foi o que eu esperava. 
1;Muito ruim; Compreis dois foi ótimo agora comprei o terceiro não prestou a câmera não presta não sei porque. 
1;Boa; Gostei bateria duradoura câmera boa não é uma reprova e original. 
5;muito satisfatorio; Produto atendeu minhas espectativas. 
5;Excelente; É o aquilo esperado. 
4;Muito bom; Produto de qualidade! recomendo!. 
5;Ótimo celular. Preço justo. ; Ótimo celular. Estou usando a 15 dias é ele voa. A bateria dura muito, carrega muito rápido, aposentei a bateria externa. Câmera boa e o celular é bem leve. O preço esta justo. Recomendo. 
5;Um ótimo celular; Ótimo produto desempenho bom não tenho o que reclamar. 
1;ARREPENDIDO; Produto veio com risco na tela, a bateria não aguenta mais de 6hrs, a tela começou a aparecer um risco rosa de fora a fora que está aumentando. Resumindo, uma porcaria !!!! estou arrependido de ter comprado. 
5;Excelente; Sem dúvidas o melhor, recomendo. 
5;Excelente; Produto perfeito. 
1;Riuim; Achei muito ruim pois o app que uso em outro motorola esse aparelho não aceita. 
5;Excelente; Telefone muito bom. Comprei para o meu padrasto e ele amou. Recomendo com certeza. 
2;preço bom, mas celular trava muito.; Bom preço, só que trava muito. 
2;Bom; Bom celular favorece as nesse idades. 
2;trava muito; Ele trava muito,e barato mais trava muito comprei sabendo q ele era ruim. 
4;Muito bom; Produto é exatamente conforme o descrito. O sinal é muito bom. Recomendo a todos do ml. 
5;Excelente; Excelente melhor impossivel. 
1;Muito ruim; Não tive a oportunidade nem mesmo de utilizar pois o mesmo esta com um problema qual seja o de não conseguir ouvir a pessoa que está do outro lado falando, mas a passoa me escuta claramente. Como fasso para efetuar a troca?. 
4;Muito bom; Aparelho muito bom,camera excelente,volume do alto falante bem alto,bateria muito boa,excelente custo beneficio. 
5;VOU COMPRAR MAS COM ESSE VENDEDOR.; Bom muito satisfeito. 
4;Ótimo aparelho ; Um bom produto, ótimo recomendo. 
1;Muito ruim; Ja esta com defeito e nem faz um mes. Que comprei. Quero saber como faço pra trocar. 
5;PERFEITO !; Perfeito , sem nenhum detalhe recomendo !. 
5;Muito bom; Não precisa tá carregando tdo dia. 
4;satisfeita; Muito bom e bonito, porem, demora muito para abrir. A bateria dura bastante!. 
1;Aparelho muito ruin; Muito ruim,não comprem é só raiva que vcs vão passar. 
2;Lindo aparelho, porém não me agradou; O aparelho é muito bonito- designer maravilhoso. Porém, várias vezes travou as operações e comandos. Tive que reiniciar ou desligar. Esses problemas ainda persistem. Infelizmente, foi uma compra frustrante. 
5;mais barato e melhor do que a marca da maça...; Já estou usando ele a mais de um mês,, e ate agora so tenho que falar bem,,,, nao achei nem um ponto ruim. 
1;Veio comproblema e nao querem resolver ; Veio com problema e nao querem resolver. 
5;dez; Excelente produto ,qualidade nota dez. 
5;Muito espaço interno...; Muito espaço interno, boa câmera com zoom e custo benefício idem. 
1;Lamentável!!; Adquirir dois celulares do mesmo modelo em meses diferente, após três a seis meses de uso ambos as baterias ficaram viciadas ao ponto de não conseguir mais ligar o celular e detalhe não consegue achar esse modelo de bateria!. 
5;Excelente; Otimo produto, estou satisfeito. 
5;muito bom; O sony xperia t3 d5106 e muito lindo muito bom detalhes lindos. 
5;Excelente; Ótimo aparelho, bom demais de sinal!. 
5;defeito; Veio com defeito , não gostei,ruim. 
5;ótimo ; Ótimo. 
2;Pesquisando; Celular muito bonito , porém ruim de área. 
1;Não é para terceira idade!; Telefone não foi pensado para terceira idade de forma alguma! somente botões maiores não resolve. O sistema é muito complicado até para gerações mais novas. Se for para os seus pais ou avós corra para outro aparelho!. 
2;Regular; Cumpre o que está anunciado. Não é tudo que falam. 
2;Ruim; Não é do jeito que eu queria não a configuração é diferente do que eu tenho. 
1;Nao gostei; Trava bastante e a bateria não aguenta nada, ligou a internet a bateria some. 
1;muito ruim; Trava muito, pode ser grande, fesh na frente mas nao da. 
2;Ruim; Comprei pro meu tio mais não veio com tv digital igual ao que eu já tenho!. 
5;Excelente; Ótimo produto, respondeu as minhas expectativas. 
5;Excelente; Muito bom. Design moderno e funcional. Além disso, muito lindo. Atende minhas necessidades. 
2;Decpcionada!; O celular é bom (original), porém o carregador e fone não são originais do aparelho, muito decepcionada! a caixa veio toda aberta , tudo solto na caixa xacalhando , inclusive película de vidro veio quebrada devido, estar tudo solto. 
5;ok; Tudo oktudo oktudo oktudo oktudo oktudo oktudo oktudo oktudo oktudo oktudo oktudo oktudo oktudo oktudo oktudo oktudo oktudo oktudo oktudo oktudo oktudo oktudo oktudo oktudo ok. 
5;Perfeeito, muito bom, recomendo; Excelente produto. 
1;Muito ruim; Não atendeu minhas expectativas, celular aparece propagandas a todos momento não consigo nem atualizar alguns aplicativos faz download sozinho de alguns programas algumas partes não são traduzidas para português, carregador veio com defeito e na cor errada! infelizmente não foi uma boa compra. 
4;Muito bom; Muito bom o produto gostei demais. 
5;Excelente; Ótimo custo / benefício. Recomendo para empresas. 
1;Produto ruim; Arrependi de ter comprado não desbloqueia é uma réplica ainda nem usei não aconselho ninguém a comprar. 
5;Excelente; Produto excelente superou as expectativas. Eu o recomendo. 
2;Nao gostei...; Mediano. O carregador não é original e o aparelho trava muito. Ficou devendo. 
5;Otimo celular; Otimo celular, bateria dura mesmo, otimo negocio. 
5;Excelente; Top ótimo celular vale a pena vou comprar outro pra dar de presente. 
5;Muito bom; Gostei do produto muito bom excelente. 
5;Excelente; Otimo estado conforme idealizei. 
1;Muito ruim; Me prometeram me mandar a antena da tv digital e ate hoje nao me mandaram. 
2;Trava muito; O celular é lindo, mas trava muito e não deveria por ter memória de 32 mp. Gostaria de saber se é original. O material é muito leve. 
1;Ruim; Um produto muito bom, porém o carregador veio com defeito e o celular levou um queda e quebrou a película e rachou um pouco a tela do celular!. Obs: película não e original do celular. 
2;Ruim; A câmera tanto da frente quanto a de trás é horrível. Muito ruim. 
5;Maravilha ; Telefone muito bom minha mãe amou obrigado. 
4;Muito bom; Muito bom, já conhecia alguns da marca. 
4;Bom produto pelo custo beneficio; Gostei do aparelho porem memoria e pocuca, porem pelo custo beneficio. 
1;Veio com defeito; Veio com defeito. 
5;celular de trabalho melhor em tudo ; Ótimo aqui na roça pegou bem de sinal agora a so esperando a bateria descarregar pra ter noção da durabilidade mais gostei. 
5;Maravilhosooo; Celular otimo vale mto a pena melhor do que a maioria dos nacionais. 
1;Muito ruim; Muito ruim. Dinheiro jogado fora. 
4;Muito bom; Tudo como prometido. Celular lenovo vibe k6 octa-cor capa e pelicula de brinde. 
1;Muito ruim; Bom dia o aparelho veio com um sistema operacional android sem o número do pin e agora parou de funcionar pois travou tudo e pede pra fazer login com o numero do pin como nao tenho estou sem celular. 
5;Excelente; Ótimo produto acelente custo benefício. Muito rápido pelo preço ótimo. 
5;MUITO BOM QUANDO O PRODUTO É O QUE VC ESPERA; É exatamente o que é anunciado estou feliz. 
1;Réplica a caixa veio violada e com defeito no apar; Produto replica,caixa veio violada. 
5;Excelente; Show de bola. Perfeito. Telefone acima da média. 
1;Muito ruim; Massa demais um produto de qualidade. 
2;Bom; Olha é um produto q não muda nada do iphone 7. 
1;Muito ruim; Eu devolvi este aparelho, estou aguardando a devolução do meu dinheiro. 
2;quebra um galho; Quando veio ,veio ótimo mais depois de menos de um mes o celulra formatou sozinho e apagou todas as fotos e videos. 
5;Excelente; É um celular com mais tecnologia, mais bonito. As funções são práticas e rápidas. A qualidade das fotos de ambas as câmeras é ótima. Amei. 
1;Der atenção aos seus clientes! Só q perde e vocês; O telefone está com defeito, e estou precisando do danfe , documento auxiliar a nota fiscal. Estou mandando mensagem para os senhores, e vocês não estão dando a mínima atenção. 
1;Horrivel não comprem a ele ; O produto é réplica e outra nem o chip tá pegando muito ruim era um presente pra minha mãe cara ela ficou feliz e depois triste quando soube que n prestava affs tanto que eu pedi. 
1;Não presta ; Não é como o que comprei da lg na loja por fora é idêntico mas as configurações, volume e qualidade do carregador são inferiores, inclusive o carregador queimou em 30 dias. 
5;otimo; Execelente, super recomendo os produtos deles, originais otima, lachado. 
1;Ótimo.; Ótimo do jeito que eu esperava fiquei muito contente. 
1;Péssimo ; Péssimo. N tem memória. N recomendo. Estou tentando recuperar meu dinheiro. Ja encaminhei tive prejuízo de 33. 00 q os correios me contaram. 
2;Estou preocupada gostaria de uma solução. ; Comprei o celular mais ele está esquentando. Muito e descarregando muito rápido. O que posso fazer para resolver era este problema. 
5;10; Ótimo e rápido aconselho a todos. 
2;Ruim; Descartável e bateria muito fraca!!!. 
1;Ppéssimo ; Ruim. A bateria não segura carga, ficou de enviar outra e até agora nada. 
4;Muito bom; Produto muito bom , gostei do acabamento leve e rápido, serve o proposito para qual foi adquirido. Funciona perfeitamente. 
1;Muito ruim; Pior celular q existe!!!!!!!!!. 
4;Funciona bem; O celular funciona muito bem. ??. 
1;Desistam!; Pessimo de usar. Ninguém consegue se adaptar. Nem mesmo os idosos. Tudo é difícil e nada funcional. 
1;Não é de boa qualidade ; Não é de boa qualidade, não consigo abaixar aplicativos pelo motivo de travar. 
1;Muito ruim; Tranca bastante demora voltar a tela inicial. 
5;Indico o produto ; Otimo. 
5;Otimo; Excelente supriu as espectativas. 
2;Comprei porque diz na descricao que é original; Funciona mas nao é original!. 
1;Camera frontal enganosa. Tem no maximo 3 mpx. ; Câmera frontal do lg k10 novo é péssima. Já vendi o meu celular. Já vendi o meu. 
1;Produto adquirido não é original.; Quando resolvi comprar o aparelho de celular lg, pensei que fosse original. Porém ao receber a mercadoria identifiquei que não é. 
4;Muito bom; Muito bom. 
1;O celular não está funcionando; Não gostei, agora não consigo fazer ligações. Quero meu dinheiro de volta. 
5;Excelente; Ótimo custo-benefício. 
4;Muito bom; Boa moite recomendo o produto muito bom. 
5;Ótimo pega bem. ..; É um bom produto recomendo a todos. . 
5;Excelente; Otímo. 
1;Muito ruim; Não gostei é replica e ele trava toda hora fiquei muinto decepcionada. 
5;Bom; Muito bom!. 
2;nao gostei; Blu grand m trava muito nao gostei dele aff celular horrivel. 
5;Excelente; Tudo ok. 
5;Ótimo produto que atende às expectativas médias; Produto ótimo e completo. Com alguns pequenos ajustes este aparelho atendeu as expectativas que um primeiro celular comprado para minha mãe poderia oferecer. 
2;Ruim; Não gostei produto não é brasileiro e exportado. 
5;Sofisticado; Melhor do que eu esperava!. 
1;trava muito // e lento; O telefone e muito lento e trava muito. 
5;Excelente; Aparelho excelente para quem precisa de um celular para dia a dia e que não exija muita tecnologia. Excelente recomendo totalmente. 
2;Whatsapp ; O aparelho é bom. Porém a partir de dezembro o whatsapp não será mais compatível a ele. Então perdi meu tempo. 
5;Eficiência ; Produto muito eficaz. Qualidade das fotos boas, armazenamento com bom espaço. Recomendo. Valew. 
1;Estou satisfeito com minha compra; Produto bom , recomendo. 
5;100%; Produto 100% exatamente como descrito. 
1;a câmera e pesima; Não esse célula não e bom porque nem original e. 
5;satisfeito; Produto de boa qualidade recomendo. 
1;produto de cor errada erra dourado ; Produto de cor errada erra dourado. 
2;Ruim; O celular esta com mau funcionamento. Fica travando, os aplicativo ficam fechando sozinho, tem app que não funciona direito nele. Não estou gostando, o que poderia ser feito?. 
1;Produto semelhante a réplica ; Não gostei!produto muito diferente do original,começando pela câmara traseira e a frontal não tem flash!!!não recomendo. 
5;Excelente; Simplemente excelente!! celular veio novo, muito além das expectativas!!. 
4;Custo benefício ; Bom vale custo beneficio. 
5;Excelente; Muito bom o celular foi mais que o esperado. 
1;Muito ruim; Ruim, não recomendo. Parou de funciona. 
4;Blu, celular que está crescendo nas vendas.; É um produto bom, pelo preço recompensa, a minha bateria veio com defeito valeu. 
1;Muito ruim; Veio sem a nota fiscal,e sem garantia. 
1;muito ruim; Infelismente, produto muito fraco e totalmente diferente do que eu já tinha que era o mesmo aparelho e da mesma marca. 
2;Otimo; Mto bom, gostei mto e recomendo para outras pessoas. 
1;SOLICITANDO TROCA; Solicito troca do aparelho esta travando direto. . Aguardo instruções,. 
5;Bom produto; Muito bom ,dei para minha mãe e ela gostou muito. 
1;Muito ruim; O produto nao funcionou o cabo nao conecta direito, estou a usar o antigo que esta sem capainha. 
5;Pratico; Bom produto satisfaz a necessidade de um usuário que não quer muita tecnologia e sim um produto de qualidade que tenha como principal função facilitar seu manuseio, muito bom ao que se propôe. 
5;Produto; Nada. 
2;Razoável ; Tela trava quando passo de baixo p/ cima. Ou vice versa. 
1;Quero.a nota fiscal e o.manual; Gostaria de saber porque. Não veio. O manual e nem nota fiscal. 
5;Excelente; Muito bom o produto recomendo. 
1;Produto top; Excelente ótimo produto foi bem o que eu esperava. 
2;.; Devolvi-o. Não tinha como usar. Tudo em inglês. 
