1;Muito ruim trava muito e não funcionou o fone ; A conexão com o fone de ouvido não funcionou e trava muito não gostei ??. 
5;Top! ; Celulares muito bons para qualquer situação. 
2;Ruim; Muito baixo o toque dele. Meu marido nao gostou. 
1;Muito ruim; Pensei que esse aparelho fosse nacional, pois se trata de um aparelho importado. 
1;Péssimo compra não inico.; Péssimo produto estou esperando meu dinheiro de volta. Não compro e não indico. Sai fora desse produto. 
1;Péssimo; Horrível telefone não possui radio, configuração e péssima vários erros linguagem em português não funciona em vários pontos como na agenda esquenta de mais notificação de adicionar atalho não sai da tela do ecrã. 
2;Ruim; 
1;Muito ruim; Produto optimo como esperava câmera boa para selfies. 
1;Esse produto não é original, é réplica!; Esse produto não é original, é réplica!. 
5;Otimo; Otimo produto atende perfeitamente aos meus critérios. 
1;Muito ruim; O cel esyragou e a asistencia nao responde. 
5;Excelente; Muinto bom amei superou minhas espectativas. 
1;Péssimo ; Péssimo horrível não presta pra nada. Não funciona as funções necessária como uma simples ligação desliga em menós de 5 segundos. 
1;porcaria de cel; Lixooooo fica travando no aplicatico radiosnet quero cancelamento dessa bagaça nunca mais troco um lg por j7. 
5;versao otima para quem usa pouco ; Produto bom. Baixo custo beneficio. Por ser paralelo e melhor que muitos smartphone caros. Eu recomendo. 
1;Foi feito tudo como combinado; Muito bom, gostei veio tudo certinho. 
5;BOM ATENDIMENTO - TUDO CERTINHO; Bom produto atende as descrições. 
1;Muito ruim; Não gostei! esperei mais do produto. 
1;Mau negócio ; O produto não funciona com a operadora oi. 
1;beleza; Focinou mais tava esquentando muito. 
5;Surpreendente; Melhor smartphone que já tive superou todas as expectativas, a bateria dura muito. 
5;é uma ótima compra; Ótimo celular é rápido e câmera é show. 
2;Razoável; Razoável. Espaco interno bom tbm até agora tô gostando. 
5;amei; Amei esse telefone tudo igual ao anucio. 
1;ruim; Estou aguardando ate hoje resposta de um email, a mercadoria veio faltando um acessorio, e nao foi o que eu esperava. 
1;Horrível nao comprem; Péssimo produto não recomendo celular trava do nada, touch para funciona e o celular fica sem funcionar. 
1;Péssimo ; Celular é bonito mas tem só 1 gb de ram e a frequência do processador é pouca resultando em muito travamento. Ele tem imagem boa e as câmeras são razoáveis mas o desempenho que importa dou nota zero a lenovo por este aparelho. Até a próxima compra :-). 
2;Ruim; Tela muito frágil. Mesmo com pelicula de vidro e capa protetora. Em 10 dias, uma queda de meio metro já quebrou a tela. No restante é bom. 
1;Péssimo; Olá boa tarde! deixa eu falar! quero ver o que eu posso fazer pois o celular não faz ligação, trava fácil e está desligando. !!!!! quero ver o que pode ser feito. 
2;O celular parece bom, mas infelizmente deu pane.; Tive um problema com o produto. Carrego a bateria num dia e no dia seguinte desliga sem carga nenhuma. Isso sem utilizar o aparelho. 
5;Excelente; Produto muito bom custo benefício. 
1;FALSO! É UMA RÉPLICA!; Fui enganada, o celular não é original, é uma réplica!. 
5;Excelente; Bom !. 
2;Podia ser melhor; Achei médio muito lento trava demais. 
1;Muito ruim; A bateria dele nao segura carga o doa todo tem que carregar duas a tres vezes por dia se receber muitas ligacoes como e meu caso. 
1;Muito ruim; Não deu certo. Não funcionou. Perdi a compra. 
5;Excelente; Ótimo produto recomendo. 
5;Satisfeita ; Produto como descrito no site, bonito e com qualidade, satisfeita com a compra e com a nota fiscal da compra, recomendo. 
5;Excelente; Excelente super satisfeita. Obrigada. 
5;Beleza pura; Muito bom, de área, câmara, em fim gostei muito aparelho. 
5;Melhor custo beneficio da atualidade; Aparelho bem completo em termos de memória, câmera, processador, visual e armazenamento por um preço muito justo. Eu ja tinha um lenovo k5 e fiz um comparativo na pratica entre os aparelhos. O k5 tinha um processador melhor, porem chip gráfico pior, o aparelho esquentava após 40 minutos a câmera demorava para fazer o track automático e era muito dificil registrar rápido bons momentos com boa qualidade. Agora a lenovo traz um processador pouca coisa inferior, porem mais atual e com chip gráfico melhor. Ele não esquenta tanto, as duas cameras estão ótimas, o aparelho é rápido e o android casou certinho. Só acho que a lenovo ja deveria ter feito um aparelho com 3gb de memória. Se a gente for considerar os aparelhos na mesma faixa de preço o único que á altura do lenovo vibe k6 seriam os aparlehos da xiaomi. 
2;Bateria ruim; Bom só na parte de ser resistente. Bateria muito ruim e desconfigura se desligar. 
5;Excelente; Tudo certo produto muito bom. 
5;Celular nota 1.000.00; Muito bom gostei muito eu recomendo. 
5;Otimo.; Muinto bom superou minhas espectativas. 
5;Excelente; Okkkkkkkkkkkkkkkkkkkkkkkkkkk. 
2;nem um; Nao gostei comprei celular preto madaram branco totalmente insastifeito. 
5;O melhor celular que já tive; Muito bom. 
1;Muito ruim; Pessimos. Nao funciona com qualquer chip. Nao carrega e pra piorar nao consigo baixar nenhum app. Infelizmente não gostei. 
2;Mais ou menos; Muito bom, mas nao veio a pelicuca. 
5;BOM !; Bom !. 
5;Excelente; Produto de qualidade, recomento a todos. 
5;Excelente celular; Gostei do design, rápido, boa qualidade de imagens e áudios, boa tela grande. Recomendo este celular, adoro a marca samsung. 
5;otima compra; Smartphone muito bom tem um bom desempenho nao trava otimo custo beneficio amei. 
2;Razoável ; Razoável. Podia ser mais alto, já que é para idosos. 
5;Excelente; Bom produto, atendeu as expectativas recomendo. 
1;Muito ruim; Bom dia. Aparelho bom mais desliga facilmente, com isso para o idoso entra a dificuldade. 
1;Muito ruim; O celular é falso veio com a parte de traz da tampinha quebrada e não tem manual têm instruções nem configuração de chamada para colocar identificador, horrível não comprem vão se arrepender como eu ????. 
2;Ruim; Produto veio com defeito e solicitei a troca. Comprei para a minha mãe, pois sendo idosa ela necessita de teclas maiores e não precisa de recursos tecnológicos, dentro deste propósito o aparelho deve cumprir quase que na sua totalidade, mas em questão de acabamento é muito simples e achei também um pouco confuso seus menus. 
5;Excelente; Eu gostei, ta novinho ainda então continua perfeito, espero que continue assim. A bateria é durável. 
1;Muito ruim; Colocaram 32gb e mandaram 16gb não gostei da compra pois poderiam ser melhor esta venda. 
5;Excelente aparelho e otima compra que eu fiz; Muinto satisfeito com o produto e com a compra,recomendo a todos que querem compra um aparelho desse,top. 
1;ruim ; Vale nada tava com problema mas eu nao quis devolver preferi jogar fora. 
5;Produto de boa qualidade; Produto excelente. Muito prático para idoso. 
5;show de bola; Show de bola produto em perfeito estado. 
2;Bom ; Bom, mais faltou o brinde poderia ter sido ótimo. 
1;Muito ruim; Celular samsung j7 prime 32gb dual 13 mp + original esta com defeito preciso de outro ou o dinheiro de volta favor entrar em contato. 
1;Muito ruim; Náo tem memoria suficiente. 
1;Muito bom ; Muito bom amei maravilha atendeu minhas espequitativa. 
1;Muito ruim; Já comprei vários produtos por esse site gostei de todos mas esse p mim deixou a desejar. 
5;Melhor celular da atualidade!; Iphone x perfeito. Podem comprar sem medo de ser feliz! estou muito satisfeito com o meu novo celular!. 
2;Algumas considerações; Bateria não dura 24 horas e não tem nitidez nas imagens das fotos. 
2;Precisa refinar a tecnologia de construção !; Tive problemas no encaixe do chip mas, pelo preço, queria o quê?!!!. 
5;Excelente; Produto bom,para quem n vai utilizar muita coisa nele,está ótimo. Recomendo. 
5;Confiável ; Muito bom produto gostei muito. 
2;Ruim; Poderia ser melhor. Pois é um chip e em entrada sd. Ainda a câmera fica p fora. Risca fácil. Mas p quem não precisa de sd nem 2 chip é não se importa em cuidar p não riscar. É bom. 
5;Excelente; Tudo certo gosteiiiiiiiiiiiiiiiiiiiiiiiiiiiiiiiiiiiiiiiiiiiiiiiiiiiiiiiiiiiiiiiiiiiiiiiiiiiiiiiiiiiiiiiiiiiiiiiiiiiiiiiiiiiiiiiiiiiiiiiiiiiiiiiiiiiiiiiiiii. 
2;Ruim; O meu celular nao prestou e nao tem utilidade nenhuma esta na caixa ele nao pega internt nao presta. 
5;Ótimo aparelho, superou as expectativas.; Ótimo aparelho. Conforme o anunciado. Foi presente para o meu filho e ele adorou. 
2;Ruim; Não atendeu minhas expectativas, porque se trata de uma réplica do moto g5. 
5;Excelente custo-benefício.; Tudo perfeito. Excelente custo benefício. 
5;Excelente! ; Celular excelente, bom desempenho melhor custo beneficio!. 
5;Excelente; Muito bom. Era o que eu esparava. 
5;maravilha ; Perfeito, nada a declarar como problemas. Obrigado. 
5;Excelente; Gostei demais. Recomendado. 
1;Muito ruim; Ótimo produto muito bom mesmo recomendo. 
4;Recome! Vendedor correto!; Produto de qualidade! recomendo. 
5;Excelente; Adorei veio antes do tempo esperado. 
1;Muito ruim; Péssimo produto, péssimo suporte da loja, se durou 3 meses foi muito. 
1;Muito ruim; Eu não comprei j1. O que aconteceu?. 
4;Boa qualidade; Produto otima qualidade, ate momento nao tiver problema, funcionamento ok, porem nao e original!. 
1;Muito ruim; No começo foi bom mas hoje o celular amanheceu sem nenhum sinal de vida quando fui dormir tava carregado ate as três da manha tava ligado e funcionando e hoje já amanheceu assim desligado e sem sinal nenhum de vida não sei o que aconteceu já conectei ao carregador e nada sinceramente estou decepcionada com isso no começo pensei q fosse bom e agora nada só tem um mês e alguns dias de uso e já acontece isso. Vou ver se consigo enviar pra garantia são 12 meses de garantia. 
1;não gostei dessa compra; Essa vez não fiz uma boa compra. Êle não segura bateria e come todos os creditos. Se pudesse devolveria. 
4;recomendo; Recomendo. 
5;Excelente; Para mim otimo aparelho. 
1;insatisfeito com o produto .; Produto veio com defeito , esta esquentando demais ao carregar e apresentando falhas em uma ligcao , fica cortando a ligacao. 
1;Rui de mais; Rapaz esse relogio ñ vale nada ñ compre pq é rui. 
5;Top demais ; Excelente produto. 
5;Rápido, bonito e eficiente. ; Celular muito melhor do que eu esperava. Muito bonito, parece ser resistente. Tela de alta qualidade, rápido, potente e uma ótima bateria. Atualizado e suporta todos os apps que interessei em instalar. Recomendo demais o celular. Celular é muito, muito bonito. Vale cada centavo. Outra dica é comprar uma capa e película pra ter mais proteção. 
1;Muito Ruim trava de mais...; Muito ruim trava toda hora eu não recomendo!. 
5;Recomendo; Muito bom produto!!!. 
5;Excelente; Produto muito bom. 
5;Muito bom; Produto muito bom, recomendo pra todos. 
2;Sem qualidade; A capinha veio arranhada e a película não encaixa muito bem no 4x. 
1;Prosto de primeira qualidade ; Muito bom era o que eu estava esperando não trava a tv sem por cento digital. 
4;muito bom; Otimo produto dentro das expectativas. 
1;O pior celular da minha vida.; Infelizmente em me arrependi de ter comprado este celular, pois ela não oferece suporte para whatsapp, nada de e-mail, e nenhum outro aplicativo mensagens instantâneas. Não vale a pena comprar, a não ser que compra de presente para sua vovozinha. 
5;Nota 10; Produto excelente de boa qualidade aprovado. 
1;Muito ruim; Insatisfeita. 
4;Muito bom; Ótimo custo x benefício. 
1;comecei a desconfiar do site ; Veio com defeitos no carregador e na bateria e ate hoje aguardo ser solucionado esse problema pois faço vendas atraves dele ok. 
1;Fiquei decepcionado porq nao foi como eu esperava.; Vei de ferente com a tela pequena. Nao tinha o tamanho do anucio me lasquei né. 
4;Muito bom; Eh bom o celular. 
1;Ruim; O celular queimou como procede menos de 30 dias de uso. 
5;Excelente; Muito bomor o aparelho, simples, mas ótimo aparelho, só não e melhor porque não e 3g, é so gsm. 
5;otimo; Muito bom. 
5;muito bom; Muito bom , um ótimo custo beneficio. 
1;produto com defeito reclamacao encerrada sem resol; Produto veio com problema, devolvi o produto pelo correio e minha reclamacao foi encerrada sem resolver o problema. 
4;Bom; Pelo preço ótimo aparelho, dá pra fazer coisas básicas nele. 
4;Bonde só não é melhor pq descarrega muito rápido ; Bom. Só não é melhor pq descarrega muito rápido. 
5;Excelente; Otimo produto, funcionando perfeitamente. 
5;Excelente; Asim um produto bom com todas as foncionalidades perfeitas um bom desenpenho cualidade em cuaquer lugar pricipalmente nas areas rurais de baichas topografias muito bom obrigado. 
5;Excelente; Muito bom o celular. Atende perfeitamente as minhas necessidades. 
5;otimo; Bom. 
1;Muito bom; Eu amei. Pelo preço q eh está ótimo. Ele e completo n trava muito. So a câmara n e muito boa mas tbm. N eh da mas ruim. P mim esta otimo. 
5;Custo benefício e qualidade juntos ; O aparelho é lindo , super fluido, primeiro aparelho que compro da xiaomi e agora vou comprar sempre, minha namorada amou. 
5;satisfeita; Muito bom. 
2;REPLICA MUITO RUIM; Celular replica muito fraca. De baixa qualidade. 
1;Ruim; Aparentemente bonito mas não lê cartão de memória e a bateria não fica uma hora carregada. 
1;Muito ruim; Não gostei , péssimo, não pinça o cabelo e a temperatura é muito baixa, não esquenta quase nada. 
5;Adorei; Ótimo celular as vezes trava mais gosto dele. 
4;Muito bom; Muito bom, gostei do celular só não da para baixar muitos aplicativos. 
5;Ótimo Produto; Boa tarde!. Produto aprovado,. Ótimo desempenho. Estou satisfeita. Se precisar compro novamente. 
1;Muito ruim; Não funciona não aceita o chipi. 
5;Excelente, muito bom.; Muito bom, excelente aparelho!!!. 
4;Bom; Muito bom! superou as espectativas. 
5;Excelente; Bom. 
2;Ruim; Não gostei muito não quando desligo não quer mais ligar aparece uma tela preta em inglês e trava muito nem parece que é um produto original. 
1;Ruim demais.se soubesse nem tinha comprado; Muito ruim. Nao funciona direito,trava demais, o wi-fi desliga toda hora do nada etc. Etc. E nao vem com o jeito da samsung, vem com as funcoes motorola. Muito diferente do que eu imaginei que fosse. Decepcionado loja orro. Obs: tambem aparece anuncios do nada igual ao youtube (que tambem nao funciona bem. ). 
5;Excelente; Tudo certo recomendo os aparelhos. 
2;Me arrependi; Não é ruim porém não é totalmente original a bateria não dura o dia inteiro como prometido e as vezes dá uma doideira na tela fica aumentando e diminuindo sozinha,e melhor pagar um pouco mais e comprar o nacional. 
4;Muito bom; Ótimo. 
5;ótimo ; Ótimo, um luxo muito bom mesmo eu recomendo a todos. 
1;Uma merda; Fica dando pane na tela sozinho. 
1;O vendedor me enrolou abri uma reclamação dele ; È uma draga não dou nenhuma estrela dei uma porque senão minha opinião não envia. 
5;Bom da mais.; Muito bom, ótimo custo benefício. 
5;Bom; Muito bom. 
2;Ruim; Imagem fotografia péssima ,não gostei ufff. 
4;Muito bom; Otimo produto parabens. 
5;Muito bom vendedor cumpriu o combinado ...nota 10; Bom pra idoso usar. 
1;Muito ruim; Celular muito ruim, material fraco apesar de ser um celular simples deveria ser de mais qualidade. 
1;Muito bom; Ótimo gostei muito do aparelho tem excelente câmera memoria. 
1;Eu gostei minha esposa nao ; Celular eu gostei minha esposa nao. 
1;Péssimo ; Já veio com o fone ruim não esculto quem fala na ligação. E não me respondem. 
5;superou minhas expectativas; Ótimo muito bom,funciona muito bem conforme eu esperava ,pois ja tinha a antena rural. 
5;excelente; Ótimo, muito bom. Esto satisfeito. Se foce maior a tela era melhor, mais não e um problema de vocês e sim meu porque eu comprei esse, deveria ter comprado um maior. 
1;Básico ; E bom mas bem simples. 
1;Muito ruim; Ótimo. 
2;Ruim; O telefone é muito ruim area. 
1;Péssimo ; O celular veio travado e nem na assistência conseguiram destravar. Perdir meu dinheiro nessa compra. 
5;Vale a pena comprar.; Ótimo aparelho, rápido e bonito. Vale a pena. 
4;excelente; Acabei de receber o produto e tudo bem até agora. Otimo produto. Atendeu minhas espectativas. Muito bom. 
5;Bom; O celular é bom e reaistente, mas a bateria dura 1 dia se for usado moderadamente. 
1;NADA CONSTA NÃO TO SATISFEITO; Veio errado o produto quero trocar ta enrolado quero soluça0 ta demorando. 
1;Muito ruim; Não gostei, não vem nota fiscal e nem tem o selo da anatel. 
1;Muito ruim; Não me dei bem o meu durou uma semana e o suporte não é muito bom demora pra responder e não passa informações precisas pra resolver. 
5;Excelente; Aparelho perfeito. 
1;Veio com defeito só stresso.; Não gostei. Veio com defeito, só stress. 
2;Ruim; Não gostei não conseguimos baixá nada trava ato do momento não gostei mim arrependi. 
5;adorei; Produto ecelente. 
1;horrivel ; Uma verdadeira porcaria, não tem memória ne para o sistema operacional, vive pedindo para liberar espaço. 
1;UM LIXO; Uma porcaria, se pudesse voltar atrás não teria nem cobrado :/. 
2;Da pra usar mais ja vi melhores; Nao parece ser o idioma portugues mais tou usando nao deu nenhum problema ate agora. 
1;Muito ruim; Celular não está segurando carga e não tenho retorno algum. 
1;Produto muito ruim de péssima qualidade; Péssima qualidade veio com defeito. 
5;Excelente; Otimo. 
2;nao gostei do celular; Não gostei do produto comprei pra minha vó e ela esta tendo dificuldades pois quando ela vai ligar aperece chamada terminada mto ruim. 
5; Produto muito bom; Muito bom adorei o produto ainda estou curtindo e aprendo mais sobre esse produto. 
5;Excelente; Ótimo produto simples e q funciona pra quem busca celular só pra trabalho!!!. 
1;Nunca será um Nokia original. ; Produto não é original nokia. As evidências são claras, sistema operacional identico a qualquer celular xing-ling, bateria da marca desconhecida flybee, sem qualquer tipo de certificado da nokia ou da anatel. Nao veio nenhum manual sobre o produto, carregador generico. Ou seja, é só mais um celular xing ling que usa apenas o nome de uma marca famosa. Pra quem quer apenas usar para fazer ligacoes serve, só não deixe cair no chao pq nao eh resistente igual a um nokia original. 
5;Excelente; Otimo. 
1;Reclamacao ; Celular veio com um problema no microfone do siri e depois comecou a apresentar problemas no touch. Enviei pra eles atraves da garantia, mais eles nao me eespondem a situacao do celular. Ja tem mais de 35 dias. 
5;Maravilhoso; Ótimo produto, atendeu minhas expectativas. As fotos ficam lindas e o android bem atual. 
1;Produto nao é o mesmo do anuncio. ; Vendendo xiaomi redmi note 4 por 4x, autonomia de bateria totalmente diferente do 4x real, so fiquei com o aparelho pois estava sem celular a um mês e precisava muito, mas esse aparelho nao é o redmi note 4x. 
2;Touch parou de funcionar com um mês de uso; Celular excelente. Rápido e a bateria dura dois dias sem esforço. O único problema é que o touch dele parou de funcionar com menos de um mês de uso. 
4;Muito bom; Foi bom negociar com ele foi rápido boas venda recomendo a todos. 
2;mais ou menos; Bom mais demorou muito pra chegar. 
5;Excelente; Excelente produto. 
5;Eu recomendo ; Muito bom eu recomendo. Tem uma boa qualidade de som. 
5;Excelente; Ótimo. 
4;Muito bom; Atendeu minhas necessidades. Bom aparelho. 
1;Otima compra; Muito bom. Ótimo custo benefício. 
2;Nao originsl; Devolvido não atendia as expectativas. 
5;Produto muito bom ,índico a quiser comprar.; Produto de ótima qualidade. 
5;Ótimo. atendeu todas as expectativas!! Recomendo; Aparelho mt bom. Bonito leve sensor de impressão digital funciona mt bem. O aparelho é melhor que o esperado. A atualização corrige os erros q falam q ele tem, para um aparelho desse preço tem uma otima camera, pra um smartphone de entrada. Bateria dura o normal, carregador de 2a que é mt bom. Gostei da le novo. Ah e o som é razoavelmetne bom tbm pra essa faixa de preço tem um audio mt bom. Mas podia vir um fone melhor. Resumindo pra quem quer um celular bom e n quer gastar esse é um bom aparelho de entrada, alm de ter armazenamento expansivel ele é rapido bonto e seguro. 
4;Show.; Produto muito bom, vale a pena adquirir. 
2;problemas ; Boa tarde comprei um celular lenono vibe c2 dual chip com vocês e ontem ele estava descarregando e apagou todo , coloquei para carregar e ele não acendeu ficou bastante tempo e não ligou ele está esquentando mas não liga. O que devo fazer ?. 
5;Excelente; Comprei para meu filho e é um produto de excelente qualidade. 
1;N gostei; N gostei mt. 
5;Sensacional ; Pequeno e completo, super recomendo. 
5;Vendedores como este bom de mais obrigado ; Produto de boa qualidade. Não pensei que seria tão bom me surpreendeu. 
1;Não gostei; Não consegui ouvir música. E achei o modelo muito grande. 
5;Excelente; Muito prestativos e pontual. 
1;Tem nota; Quero minha nota fiscal se não vou devolver. 
1;Ruim; O celular funcionou só uns 15 dias e deu problema, quero saber como podem resolver isso para mim. 
5;Super ferramenta!; Smartphone asus zenfone 2 supera as expectativas. Excelente custo benefício. É muito prático e a câmera de muito boa qualidade. A bateria dura tranquilamente durante todo o dia. 
1;Não gostei; Não gostei muito lento e trava de mais. 
4;Muito bom; Serviu pro que eu estava precisando. 
5;Excelente; Ótimo produto. 
1;bonito; Eu gostei so que vir aranhado. 
1;Muito ruim; Não gostei. 
5;CELULAR TOP; Celular top , para quem quer ter aplicativos e estar conectado com a internet , celular proprio para isso ,tem resposta muito rapida nos comandos , camera dou uma nota 8 , melhor custo beneficio que já tive , recomendo com certeza. 
5;Excelente; Excelente estou muito satisfeito vou comprar +1. 
5;Excelente; Excelente. 
5;produto de excelente qualidade; Produto de excelente qualidade! com 32 g de memoria 3 de ram!. 
5;EXCELENTE; Excelenteeeeeeeeeeeee smartphone gostei de mais autonomia ótima de batéria rapidês ,não trava nada viva a xiaomi. 
1;Ruim; A rede que eu queria que pegase nao pega de geito nenhum fui na assistencia e em diseram que o problema é no celular. 
1;Bom; Muito bom produto!!! valeu a pena. 
5;Excelente; Ótimo produto, exatamente oq esperava. 
1;Muito ruim; Não gostei, fala q tem discagem rápida, mas não tem, com um dia de uso teve uma pequena quedinha, de meio metro de altura, de cima da cama, e quebrou, rachou, bom essa é minha opinião, não compraria dinovo, comprei p minha mãe,ela não gostou. 
2;Ruim.; Produto ruim. Depois de 6 meses estragou. Não recomendo. 
1;Exelente; Produto muito bom pode comprar vale a pena. 
2;Ruim; Nao gostei,desliga toda hora. 
2;Ruim; A bateria do celular riou não sei se recomendo. 
5;Ótimo ; Produto de boa qualidade. Gostei muito. 
5;excelente celular; Muito bom. 
2;Ruim; A câmera e a bateria são péssimos!. 
5;Excelente; Fico sem palavras. 
1;Ruim; Produto muito ruim ,vcs deveria dizer que o produto é similar. 
2;Uma mercadoria de qualidade!; Muito bom atendeu bem. Minhas expectativas ate hj não me deu nenhum problema. 
5;Excelente; É um celular funciona. 
1;Anuncio Falso; Relato da minha compra. O produto é vendido como de vitrine, quando na verdade é um produto ele é um produto que foi feito manutenção e vendido como de vitrine. Com os seguintes detalhes:. A tela foi trocada e apresenta uma listra branca. Nem parece super amoled. A carcaça foi trocada, tanto que foi trocada que o selo do imei na traseira foi colado no lugar errado. . A tampa traseira não tem a testura da tampa original. O leitor de digital vive dando erro de leitura. A bateria veio com marcas de uso. . Encerrando a explicação:. . Eles estão vendendo uma coisa e anunciando outra. 
2;Ruim; Ruim, lento. Sei que pelo valor, não deveria esperar grande coisa, mas veio abaixo da expectativa. 
4;Custo benefício; Bom produto, muito simpples e com ótimo custo benefício. 
1;Muito ruim; Seria melhor se desse para atualizalo, ou se vinhece atualizado. 
5;Ótimo custo x benefício; Ótimo custo x benefício, aparelho simples, para fazer e receber ligações, enviar e receber sms. Possui alarme despertador e teclado luminoso. Muito leve e compacto, parece até de brinquedo, bateria dura muito. Recomendo. 
5;Excelente; Aparelho muito bom, eu recomendo. 
5;Excelente custo benefício. ; Muito bom. 
1;Nao liga; O meu veio com defeito nao liga nada. 
1;DESRESPEITO COM O CLIENTE; Não responde as mensagens, o celular com menos de 3 meses de uso começou a dar problema nos autos falante. Indignado, visualiza as mensagens porém não responde nenhuma delas, pelo visto irei ter que acionar o procon. 
1;nao gostei; Fiquei muito triste,trava muito e nao atualiza o googlo play. Fala que a memoria e insuficiente. 
5;Bom bonito e barato; Ótimo, tela linda, grande mto bom msm, recomendo. 
2;Ruim; Não manda nota fiscal, disse que está escrito nas letras pequenas, absurdo. 
2;Bom dia; Muito bom e atende as necessidades. 
2;Ruim; Não gostei. 
1;Gostaria de cancelar essa compra; Esse aparelho é do paraguay ou é um aparelho de assistência técnica, pq o mesmo não veio com manual de instrução e nem na caixa original do aparelho e com apenas 3 meses de garantia, se soubesse disso não teria comprado. 
1;Volume muito baixo , ele não gostou; O meu esposo não gostou volume muito baixo horrível. 
